The Body Said No!	/wiki/The_Body_Said_No!	1950	Val Guest	Michael Rennie, Yolande Donlan, Hy Hazell, Jon Pertwee	Comedy	NULL	UK
Cage of Gold	/wiki/Cage_of_Gold	1950	Basil Dearden	Jean Simmons, Herbert Lom	Drama	NULL	UK
Cairo Road	/wiki/Cairo_Road_(film)	1950	David MacDonald	Laurence Harvey, Eric Portman, Maria Mauban	Crime	NULL	UK
Chance of a Lifetime	/wiki/Chance_of_a_Lifetime_(1950_film)	1950	Bernard Miles	Basil Radford, Niall MacGinnis, Bernard Miles	Drama	NULL	UK
Come Dance with Me	/wiki/Come_Dance_with_Me_(1950_film)	1950	Mario Zampi	Max Wall, Gordon Humphris	Musical	NULL	UK
Dance Hall	/wiki/Dance_Hall_(1950_film)	1950	Charles Crichton	Petula Clark, Natasha Parry, Diana Dors	Musical	Ealing Studios	UK
The Dancing Years	/wiki/The_Dancing_Years_(film)	1950	Harold French	Dennis Price, Gisèle Préville	Musical	NULL	UK
Dark Interval	/wiki/Dark_Interval	1950	Charles Saunders	Zena Marshall, Andrew Osborn	Crime	NULL	UK
Dick Barton at Bay	/wiki/Dick_Barton_at_Bay	1950	Godfrey Grayson	Don Stannard	Action based on radio serial	NULL	UK
The Dragon of Pendragon Castle	/wiki/The_Dragon_of_Pendragon_Castle	1950	John Baxter	Robin Netscher, Hilary Rennie, Graham Moffatt	Family	NULL	UK
The Elusive Pimpernel	/wiki/The_Elusive_Pimpernel	1950	Michael Powell, Emeric Pressburger	David Niven, Margaret Leighton, Cyril Cusack	Adventure	NULL	UK
The Fall of the House of Usher	/wiki/The_Fall_of_the_House_of_Usher_(1950_film)	1950	Ivan Barnett	Gwen Watford, Kay Tendeter	Horror	NULL	UK
Four Men in Prison	/wiki/Four_Men_in_Prison	1950	Max Anderson	William Mervyn, Arthur Mullard	Documentary	NULL	UK
Golden Salamander	/wiki/Golden_Salamander_(film)	1950	Ronald Neame	Trevor Howard, Anouk Aimée	Thriller	NULL	UK
Gone to Earth	/wiki/Gone_to_Earth_(film)	1950	Michael Powell, Emeric Pressburger	Jennifer Jones, David Farrar	Romance	NULL	UK
Guilt Is My Shadow	/wiki/Guilt_Is_My_Shadow	1950	Roy Kellino	Elizabeth Sellars, Patrick Holt	Drama	NULL	UK
The Happiest Days of Your Life	/wiki/The_Happiest_Days_of_Your_Life	1950	Frank Launder	Alastair Sim, Margaret Rutherford	Comedy	NULL	UK
Her Favourite Husband	/wiki/Her_Favourite_Husband	1950	Mario Soldati	Jean Kent, Robert Beatty	Comedy	Co-production with Italy	UK
Highly Dangerous	/wiki/Highly_Dangerous	1950	Roy Ward Baker	Margaret Lockwood, Marius Goring	Spy	NULL	UK
The Kangaroo Kid	/wiki/The_Kangaroo_Kid_(film)	1950	Lesley Selander	Jock Mahoney, Veda Ann Borg	Western	Co-production with Australia	UK
Into the Blue	/wiki/Into_the_Blue_(1950_film)	1950	Herbert Wilcox	Michael Wilding, Odile Versois	Comedy	NULL	UK
Last Holiday	/wiki/Last_Holiday_(1950_film)	1950	Henry Cass	Alec Guinness, Beatrice Campbell, Kay Walsh	Comedy	Ealing Studios	UK
Lilli Marlene	/wiki/Lilli_Marlene_(film)	1950	Arthur Crabtree	Hugh McDermott, Lisa Daniely	Drama	NULL	UK
Madeleine	/wiki/Madeleine_(1950_film)	1950	David Lean	Stanley Haynes, Nicholas Phipps	Biopic	NULL	UK
The Magnet	/wiki/The_Magnet_(film)	1950	Charles Frend	Stephen Murray, Kay Walsh	Comedy/Drama	NULL	UK
Midnight Episode	/wiki/Midnight_Episode	1950	Gordon Parry	Stanley Holloway, Leslie Dwyer	Mystery	NULL	UK
Morning Departure	/wiki/Morning_Departure	1950	Roy Ward Baker	John Mills, Nigel Patrick	War	NULL	UK
The Mudlark	/wiki/The_Mudlark	1950	Jean Negulesco	Irene Dunne, Alec Guinness	biopic	NULL	UK
Murder Without Crime	/wiki/Murder_Without_Crime	1950	J. Lee Thompson	Dennis Price, Derek Farr	Crime	NULL	UK
The Naked Heart	/wiki/The_Naked_Heart	1950	Marc Allégret	Michèle Morgan, Kieron Moore	Drama	NULL	UK
Night and the City	/wiki/Night_and_the_City	1950	Jules Dassin	Richard Widmark, Gene Tierney, Googie Withers	Crime	NULL	UK
No Place for Jennifer	/wiki/No_Place_for_Jennifer	1950	Henry Cass	Leo Genn, Rosamund John	Drama	NULL	UK
No Trace	/wiki/No_Trace	1950	John Gilling	Hugh Sinclair, Dinah Sheridan	Crime	NULL	UK
Odette	/wiki/Odette_(film)	1950	Herbert Wilcox	Anna Neagle, Trevor Howard	World War II/Spy	NULL	UK
Old Mother Riley Headmistress	/wiki/Old_Mother_Riley_Headmistress	1950	John Harlow	Arthur Lucan, Kitty McShane	Comedy	NULL	UK
Once a Sinner	/wiki/Once_a_Sinner	1950	Lewis Gilbert	Patricia Kirkwood, Jack Watling	Drama	NULL	UK
Over the Garden Wall	/wiki/Over_the_Garden_Wall_(1950_film)	1950	John E. Blakeley	Norman Evans, Jimmy James	Comedy	NULL	UK
Paul Temple's Triumph	/wiki/Paul_Temple%27s_Triumph	1950	Maclean Rogers	John Bentley, Dinah Sheridan	Mystery	NULL	UK
Portrait of Clare	/wiki/Portrait_of_Clare	1950	Lance Comfort	Margaret Johnston, Richard Todd	Drama	NULL	UK
Prelude to Fame	/wiki/Prelude_to_Fame	1950	Fergus McDonell	Guy Rolfe, Kathleen Byron	Drama	NULL	UK
The Reluctant Widow	/wiki/The_Reluctant_Widow_(film)	1950	Bernard Knowles	Jean Kent, Guy Rolfe	Drama	NULL	UK
The Second Mate	/wiki/The_Second_Mate	1950	John Baxter	Gordon Harker, Graham Moffatt	Crime	NULL	UK
Seven Days to Noon	/wiki/Seven_Days_to_Noon	1950	John Boulting, Roy Boulting	Barry Jones, André Morell, Hugh Cross	Thriller	NULL	UK
Shadow of the Past	/wiki/Shadow_of_the_Past_(film)	1950	Mario Zampi	Joyce Howard, Terence Morgan	Crime	NULL	UK
She Shall Have Murder	/wiki/She_Shall_Have_Murder	1950	Daniel Birt	Rosamund John, Derrick De Marney	Drama	NULL	UK
So Long at the Fair	/wiki/So_Long_at_the_Fair	1950	Terence Fisher, Anthony Darnborough	Dirk Bogarde, Jean Simmons	Drama/Thriller	NULL	UK
Soho Conspiracy	/wiki/Soho_Conspiracy	1950	Cecil H. Williamson	Zena Marshall, Peter Gawthorne	Musical	NULL	UK
Something in the City	/wiki/Something_in_the_City	1950	Maclean Rogers	Richard Hearne, Garry Marsh	Comedy	NULL	UK
Stage Fright	/wiki/Stage_Fright_(1950_film)	1950	Alfred Hitchcock	Jane Wyman, Marlene Dietrich, Michael Wilding	Crime	NULL	UK
State Secret	/wiki/State_Secret_(1950_film)	1950	Sidney Gilliat	Douglas Fairbanks Jr., Jack Hawkins	Drama	NULL	UK
They Were Not Divided	/wiki/They_Were_Not_Divided	1950	Terence Young	Edward Underdown, Ralph Clanton	World War II	NULL	UK
Torment	/wiki/Torment_(1950_British_film)	1950	John Guillermin	Dermot Walsh, Rona Anderson	Thriller	NULL	UK
Treasure Island	/wiki/Treasure_Island_(1950_film)	1950	Byron Haskin	Robert Newton, Bobby Driscoll	Adventure	U.K./U.S. co-production	UK
Trio	/wiki/Trio_(film)	1950	Ken Annakin, Harold French	Jean Simmons, Kathleen Harrison	Drama	Anthology of stories by W. Somerset Maugham	UK
The Twenty Questions Murder Mystery	/wiki/The_Twenty_Questions_Murder_Mystery	1950	Paul L. Stein	Robert Beatty, Rona Anderson	Crime	NULL	UK
What the Butler Saw	/wiki/What_the_Butler_Saw_(1950_film)	1950	Godfrey Grayson	Edward Rigby, Henry Mollison	Comedy	NULL	UK
The Woman in Question	/wiki/The_Woman_in_Question	1950	Anthony Asquith	Jean Kent, Dirk Bogarde	Mystery	NULL	UK
The Woman with No Name	/wiki/The_Woman_with_No_Name	1950	Ladislao Vajda	Phyllis Calvert, Edward Underdown Richard Burton	Drama	NULL	UK
The Wooden Horse	/wiki/The_Wooden_Horse	1950	Jack Lee	Leo Genn, Anthony Steel, David Tomlinson	World War II	NULL	UK
Up for the Cup	/wiki/Up_for_the_Cup_(1950_film)	1950	Jack Raymond	Albert Modley, Mae Bacon	Sports/Comedy	NULL	UK
Waterfront	/wiki/Waterfront_(1950_film)	1950	Michael Anderson	Robert Newton, Kathleen Harrison	Drama	NULL	UK
Your Witness	/wiki/Your_Witness_(film)	1950	Robert Montgomery	Robert Montgomery, Cyril Cusack	Drama	NULL	UK
The Adventurers	/wiki/The_Adventurers_(1951_film)	1951	David MacDonald	Jack Hawkins, Peter Hammond	Adventure	NULL	UK
The African Queen	/wiki/The_African_Queen_(film)	1951	John Huston	Humphrey Bogart, Katharine Hepburn	African Adventure	NULL	UK
Another Man's Poison	/wiki/Another_Man%27s_Poison	1951	Irving Rapper	Bette Davis, Gary Merrill	Crime drama	NULL	UK
Appointment with Venus	/wiki/Appointment_with_Venus_(film)	1951	Ralph Thomas	George Coulouris, David Niven, Glynis Johns	World War II/Comedy	NULL	UK
Assassin for Hire	/wiki/Assassin_for_Hire	1951	Michael McCarthy	Sydney Tafler, Ronald Howard	Crime	NULL	UK
The Black Widow	/wiki/The_Black_Widow_(1951_film)	1951	Vernon Sewell	Christine Norden, Robert Ayres	Thriller	NULL	UK
Blackmailed	/wiki/Blackmailed_(1951_film)	1951	Marc Allégret	Mai Zetterling, Dirk Bogarde	Drama	NULL	UK
The Browning Version	/wiki/The_Browning_Version_(1951_film)	1951	Anthony Asquith	Michael Redgrave, Jean Kent, Nigel Patrick	Drama	NULL	UK
Calling Bulldog Drummond	/wiki/Calling_Bulldog_Drummond	1951	Victor Saville	Walter Pidgeon, Robert Beatty	Crime	NULL	UK
Captain Horatio Hornblower R.N.	/wiki/Captain_Horatio_Hornblower	1951	Raoul Walsh	Gregory Peck, Virginia Mayo	Adventure	NULL	UK
Circle of Danger	/wiki/Circle_of_Danger	1951	Jacques Tourneur	Ray Milland, Patricia Roc	Thriller	NULL	UK
Cloudburst	/wiki/Cloudburst_(1951_film)	1951	Francis Searle	Robert Preston, Harold Lang, Elizabeth Sellars	Drama	NULL	UK
The Clouded Yellow	/wiki/The_Clouded_Yellow	1951	Ralph Thomas	Trevor Howard, Jean Simmons	Thriller	NULL	UK
Cry, the Beloved Country	/wiki/Cry,_the_Beloved_Country_(1951_film)	1951	Zoltan Korda	Canada Lee, Sidney Poitier	African Drama	Entered into the 2nd Berlin International Film Festival	UK
The Dark Man	/wiki/The_Dark_Man_(film)	1951	Jeffrey Dell	Maxwell Reed, Edward Underdown	Thriller	NULL	UK
Encore	/wiki/Encore_(1951_film)	1951	Pat Jackson, Harold French, Anthony Pelissier	Nigel Patrick, Kay Walsh	Drama	Anthology of stories by W. Somerset Maugham	UK
Flesh and Blood	/wiki/Flesh_and_Blood_(1951_film)	1951	Anthony Kimmins	Richard Todd, Glynis Johns	Drama	NULL	UK
Four Days	/wiki/Four_Days_(film)	1951	John Guillermin	Hugh McDermott, Kathleen Byron	Drama	NULL	UK
The Franchise Affair	/wiki/The_Franchise_Affair_(film)	1951	Lawrence Huntington	Michael Denison, Dulcie Gray	Thriller	NULL	UK
The Galloping Major	/wiki/The_Galloping_Major_(film)	1951	Henry Cornelius	Basil Radford, Jimmy Hanley, Janette Scott	Comedy	NULL	UK
Green Grow the Rushes	/wiki/Green_Grow_the_Rushes_(film)	1951	Derek N. Twist	Roger Livesey, Honor Blackman	Comedy	NULL	UK
Happy Go Lovely	/wiki/Happy_Go_Lovely	1951	H. Bruce Humberstone	Vera Ellen, David Niven	Romance	NULL	UK
High Treason	/wiki/High_Treason_(1951_film)	1951	Roy Boulting	Liam Redmond, André Morell	Crime	NULL	UK
Home to Danger	/wiki/Home_to_Danger	1951	Terence Fisher	Guy Rolfe, Rona Anderson	Crime	NULL	UK
Hotel Sahara	/wiki/Hotel_Sahara	1951	Ken Annakin	Yvonne De Carlo, Peter Ustinov	Comedy	NULL	UK
I'll Get You for This	/wiki/I%27ll_Get_You_for_This	1951	Joseph M. Newman	George Raft, Coleen Gray	Crime	NULL	UK
The Lady with the Lamp	/wiki/The_Lady_with_the_Lamp_(film)	1951	Herbert Wilcox	Anna Neagle, Michael Wilding	Biopic	NULL	UK
Lady Godiva Rides Again	/wiki/Lady_Godiva_Rides_Again	1951	Frank Launder	Diana Dors, Alastair Sim	Comedy	NULL	UK
The Late Edwina Black	/wiki/The_Late_Edwina_Black	1951	Maurice Elvey	David Farrar, Geraldine Fitzgerald	Drama	NULL	UK
Laughter in Paradise	/wiki/Laughter_in_Paradise	1951	Mario Zampi	Alastair Sim, George Cole	Comedy	NULL	UK
The Lavender Hill Mob	/wiki/The_Lavender_Hill_Mob	1951	Charles Crichton	Alec Guinness, Stanley Holloway, Sid James	Comedy	Number 17 in the BFI Top 100 British films. Ealing Studios	UK
Let's Go Crazy	/wiki/Let%27s_Go_Crazy_(film)	1951	Alan Cullimore	Spike Milligan, Peter Sellers	Comedy	NULL	UK
The Long Dark Hall	/wiki/The_Long_Dark_Hall	1951	Reginald Beck, Anthony Bushell	Rex Harrison, Lilli Palmer	Crime	NULL	UK
Madame Louise	/wiki/Madame_Louise	1951	Maclean Rogers	Richard Hearne, Petula Clark, Garry Marsh	Comedy	NULL	UK
The Magic Box	/wiki/The_Magic_Box	1951	John Boulting	Robert Donat, Margaret Johnston	Biopic	NULL	UK
The Man in the White Suit	/wiki/The_Man_in_the_White_Suit	1951	Alexander Mackendrick	Alec Guinness, Joan Greenwood, Cecil Parker	Comedy	Number 58 in the BFI Top 100 British films. Ealing Studios	UK
Mister Drake's Duck	/wiki/Mister_Drake%27s_Duck	1951	Val Guest	Douglas Fairbanks Jr., Yolande Donlan	Science Fiction/Comedy	NULL	UK
Murder in the Cathedral	/wiki/Murder_in_the_Cathedral_(film)	1951	George Hoellering	John Groser, Alexander Gauge	Historical	NULL	UK
Mystery Junction	/wiki/Mystery_Junction	1951	Michael McCarthy	Sydney Tafler, Barbara Murray	Crime	NULL	UK
Night Was Our Friend	/wiki/Night_Was_Our_Friend	1951	Michael Anderson	Elizabeth Sellars, Michael Gough	Drama	NULL	UK
Night Without Stars	/wiki/Night_Without_Stars	1951	Anthony Pelissier	David Farrar, Nadia Gray	Crime	NULL	UK
No Highway in the Sky	/wiki/No_Highway_in_the_Sky	1951	Henry Koster	James Stewart, Marlene Dietrich	Drama	NULL	UK
No Resting Place	/wiki/No_Resting_Place	1951	Paul Rotha	Michael Gough	Drama	NULL	UK
Old Mother Riley's Jungle Treasure	/wiki/Old_Mother_Riley%27s_Jungle_Treasure	1951	Maclean Rogers	Arthur Lucan, Kitty McShane	Comedy	NULL	UK
One Wild Oat	/wiki/One_Wild_Oat	1951	Charles Saunders	Robertson Hare, Stanley Holloway, Sam Costa	Comedy	NULL	UK
Outcast of the Islands	/wiki/Outcast_of_the_Islands	1951	Carol Reed	Robert Morley, Trevor Howard	Drama	NULL	UK
Out of True	/wiki/Out_of_True_(film)	1951	Philip Leacock	Jane Hylton, Muriel Pavlow	Drama documentary	NULL	UK
Pandora and the Flying Dutchman	/wiki/Pandora_and_the_Flying_Dutchman	1951	Albert Lewin	Ava Gardner, James Mason, Nigel Patrick	Drama	NULL	UK
Penny Points to Paradise	/wiki/Penny_Points_to_Paradise	1951	Tony Young	Harry Secombe, Alfred Marks, Peter Sellers	Comedy	NULL	UK
Pool of London	/wiki/Pool_of_London_(film)	1951	Basil Dearden	Bonar Colleano, Earl Cameron, Susan Shaw	Drama	NULL	UK
The Quiet Woman	/wiki/The_Quiet_Woman	1951	John Gilling	Derek Bond, Jane Hylton	Crime	NULL	UK
Reluctant Heroes	/wiki/Reluctant_Heroes	1951	Jack Raymond	Ronald Shiner, Derek Farr	Comedy	NULL	UK
The Rossiter Case	/wiki/The_Rossiter_Case	1951	Francis Searle	Helen Shingler, Clement McCallin	Mystery	NULL	UK
Scarlet Thread	/wiki/Scarlet_Thread	1951	Lewis Gilbert	Kathleen Byron, Laurence Harvey	Drama	NULL	UK
Scrooge	/wiki/Scrooge_(1951_film)	1951	Brian Desmond Hurst	Alastair Sim, Mervyn Johns, Hermione Baddeley	Literary drama	NULL	UK
The Smart Aleck	/wiki/The_Smart_Aleck	1951	John Guillermin	Peter Reynolds, Mercy Haystead	Crime	NULL	UK
A Tale of Five Cities	/wiki/A_Tale_of_Five_Cities	1951	Various	Bonar Colleano, Barbara Kelly	Mystery	NULL	UK
The Tales of Hoffmann	/wiki/The_Tales_of_Hoffmann_(film)	1951	Michael Powell, Emeric Pressburger	Robert Rounseville, Moira Shearer, Ludmilla Tchérina	Ballet	Two Academy Award nominations. Entered at Cannes and Berlin	UK
There Is Another Sun	/wiki/There_Is_Another_Sun	1951	Lewis Gilbert	Maxwell Reed, Laurence Harvey	Drama	NULL	UK
The Third Visitor	/wiki/The_Third_Visitor	1951	Maurice Elvey	Sonia Dresdel, Guy Middleton	Crime	NULL	UK
Tom Brown's Schooldays	/wiki/Tom_Brown%27s_Schooldays_(1951_film)	1951	Gordon Parry	Robert Newton, John Howard Davies, James Hayter	Drama	NULL	UK
Two on the Tiles	/wiki/Two_on_the_Tiles	1951	John Guillermin	Herbert Lom, Brenda Bruce	Comedy	NULL	UK
Where No Vultures Fly	/wiki/Where_No_Vultures_Fly	1951	Harry Watt	Anthony Steel, Dinah Sheridan	African Adventure	NULL	UK
White Corridors	/wiki/White_Corridors	1951	Pat Jackson	Googie Withers, James Donald	Drama	NULL	UK
Young Wives' Tale	/wiki/Young_Wives%27_Tale	1951	Henry Cass	Joan Greenwood, Nigel Patrick, Audrey Hepburn	Comedy	NULL	UK
Angels One Five	/wiki/Angels_One_Five	1952	George More O'Ferrall	Jack Hawkins, Michael Denison	World War II	NULL	UK
Blind Man's Bluff	/wiki/Blind_Man%27s_Bluff_(1952_film)	1952	Charles Saunders	Zena Marshall, Sydney Tafler	Crime	NULL	UK
Brandy for the Parson	/wiki/Brandy_for_the_Parson	1952	John Eldridge	Kenneth More, Charles Hawtrey	Comedy	NULL	UK
The Brave Don't Cry	/wiki/The_Brave_Don%27t_Cry	1952	Philip Leacock	John Gregson	Drama	NULL	UK
The Card	/wiki/The_Card_(1952_film)	1952	Ronald Neame	Alec Guinness, Petula Clark, Glynis Johns	Romantic comedy	NULL	UK
Castle in the Air	/wiki/Castle_in_the_Air_(film)	1952	Henry Cass	David Tomlinson, Helen Cherry	Comedy	NULL	UK
Crow Hollow	/wiki/Crow_Hollow	1952	Michael McCarthy	Donald Houston, Natasha Parry	Drama	NULL	UK
Curtain Up	/wiki/Curtain_Up	1952	Ralph Smart	Robert Morley, Margaret Rutherford	Comedy	NULL	UK
Derby Day	/wiki/Derby_Day_(1952_film)	1952	Herbert Wilcox	Anna Neagle, Michael Wilcox	Drama	NULL	UK
Distant Trumpet	/wiki/Distant_Trumpet	1952	Terence Fisher	Derek Bond, Jean Patterson	Drama	NULL	UK
Down Among the Z Men	/wiki/Down_Among_the_Z_Men	1952	Maclean Rogers	Peter Sellers, Harry Secombe, Spike Milligan	Comedy	NULL	UK
Emergency Call	/wiki/Emergency_Call	1952	Lewis Gilbert	Jack Warner, Anthony Steel	Drama	NULL	UK
Escape Route	/wiki/Escape_Route_(film)	1952	Seymour Friedman, Peter Graham Scott	George Raft, Sally Gray	Thriller	NULL	UK
Father's Doing Fine	/wiki/Father%27s_Doing_Fine	1952	Henry Cass	Richard Attenborough, Heather Thatcher	Comedy	NULL	UK
The Floating Dutchman	/wiki/The_Floating_Dutchman	1952	Vernon Sewell	Dermot Walsh, Sydney Tafler	Crime	NULL	UK
The Frightened Man	/wiki/The_Frightened_Man	1952	John Gilling	Dermot Walsh, Barbara Murray	Crime	NULL	UK
The Gentle Gunman	/wiki/The_Gentle_Gunman	1952	Basil Dearden	John Mills, Dirk Bogarde	Drama	NULL	UK
Ghost Ship	/wiki/Ghost_Ship_(1952_film)	1952	Vernon Sewell	Hazel Court, Dermot Walsh	Thriller	NULL	UK
Gift Horse	/wiki/Gift_Horse_(film)	1952	Compton Bennett	Trevor Howard, Richard Attenborough	War	NULL	UK
Hammer the Toff	/wiki/Hammer_the_Toff	1952	Maclean Rogers	John Bentley, Patricia Dainton	Crime	NULL	UK
The Happy Family	/wiki/The_Happy_Family_(1952_film)	1952	Muriel Box	Stanley Holloway, Kathleen Harrison	Comedy	NULL	UK
The Holly and the Ivy	/wiki/The_Holly_and_the_Ivy_(film)	1952	George More O'Ferrall	Ralph Richardson, Celia Johnson	Drama	NULL	UK
Hindle Wakes	/wiki/Hindle_Wakes_(1952_film)	1952	Arthur Crabtree	Lisa Daniely, Brian Worth	Drama	NULL	UK
His Excellency	/wiki/His_Excellency_(1952_film)	1952	Robert Hamer	Eric Portman, Cecil Parker	Comedy	NULL	UK
Home at Seven	/wiki/Home_at_Seven_(film)	1952	Ralph Richardson	Ralph Richardson, Margaret Leighton, Jack Hawkins	Drama	NULL	UK
Hunted	/wiki/Hunted_(film)	1952	Charles Crichton	Dirk Bogarde, Jon Whiteley, Elizabeth Sellars, Kay Walsh	Crime/Drama	Golden Leopard winner at Locarno International Film Festival	UK
I Believe in You	/wiki/I_Believe_in_You_(film)	1952	Basil Dearden	Celia Johnson, Cecil Parker	Drama	NULL	UK
I'm a Stranger	/wiki/I%27m_a_Stranger	1952	Brock Williams	Greta Gynt, James Hayter	Comedy	NULL	UK
The Importance of Being Earnest	/wiki/The_Importance_of_Being_Earnest_(1952_film)	1952	Anthony Asquith	Michael Redgrave, Michael Denison, Edith Evans	Comedy	Adaptation of the play by Oscar Wilde	UK
It Started in Paradise	/wiki/It_Started_in_Paradise	1952	Compton Bennett	Jane Hylton, Muriel Pavlow, Martita Hunt	Drama	NULL	UK
Judgment Deferred	/wiki/Judgment_Deferred	1952	John Baxter	Hugh Sinclair, Helen Shingler	Drama	NULL	UK
King of the Underworld	/wiki/King_of_the_Underworld_(1952_film)	1952	Victor M. Gover	Tod Slaughter, Patrick Barr	Crime	NULL	UK
Lady in the Fog	/wiki/Lady_in_the_Fog	1952	Sam Newfield	Cesar Romero, Lois Maxwell	Mystery	NULL	UK
The Last Page	/wiki/The_Last_Page	1952	Terence Fisher	George Brent, Marguerite Chapman, Diana Dors	Crime	NULL	UK
The Lost Hours	/wiki/The_Lost_Hours	1952	David MacDonald	Mark Stevens, Jean Kent	Drama	NULL	UK
Made in Heaven	/wiki/Made_in_Heaven_(1952_film)	1952	John Paddy Carstairs	David Tomlinson, Petula Clark	Comedy	NULL	UK
The Man Who Watched Trains Go By	/wiki/The_Man_Who_Watched_Trains_Go_By	1952	Harold French	Claude Rains, Marius Goring	Crime	NULL	UK
Mandy	/wiki/Mandy_(film)	1952	Alexander Mackendrick, Fred Sears	Phyllis Calvert, Jack Hawkins, Terence Morgan	Drama	Ealing Studios	UK
Meet Me Tonight	/wiki/Meet_Me_Tonight	1952	Anthony Pelissier	Valerie Hobson, Nigel Patrick	Comedy	NULL	UK
Miss Robin Hood	/wiki/Miss_Robin_Hood	1952	John Guillermin	Margaret Rutherford, Richard Hearne	Fantasy	NULL	UK
Mother Riley Meets the Vampire	/wiki/Mother_Riley_Meets_the_Vampire	1952	John Gilling	Arthur Lucan, Bela Lugosi	Comedy	NULL	UK
Monte Carlo Baby	/wiki/Monte_Carlo_Baby	1952	Jean Boyer, Lester Fuller	Audrey Hepburn	Comedy	NULL	UK
Moulin Rouge	/wiki/Moulin_Rouge_(1952_film)	1952	John Huston	José Ferrer, Zsa Zsa Gabor, Suzanne Flon	Biopic	NULL	UK
Mr. Denning Drives North	/wiki/Mr._Denning_Drives_North	1952	Anthony Kimmins	John Mills, Phyllis Calvert	Mystery	NULL	UK
My Wife's Lodger	/wiki/My_Wife%27s_Lodger	1952	Maurice Elvey	Dominic Roche, Olive Sloane	Comedy	NULL	UK
Never Look Back	/wiki/Never_Look_Back_(1952_film)	1952	Francis Searle	Rosamund John, Hugh Sinclair	Drama	NULL	UK
Never Take No for an Answer	/wiki/Never_Take_No_for_an_Answer	1952	Maurice Cloche, Ralph Smart	Vittorio Manunta, Denis O'Dea	Drama	NULL	UK
Paul Temple Returns	/wiki/Paul_Temple_Returns	1952	Maclean Rogers	John Bentley, Patricia Dainton, Peter Gawthorne	Thriller	NULL	UK
Penny Princess	/wiki/Penny_Princess	1952	Val Guest	Yolande Donlan, Dirk Bogarde	Comedy	First British film shot in Spain	UK
The Pickwick Papers	/wiki/The_Pickwick_Papers_(1952_film)	1952	Noel Langley	James Hayter, Hermione Baddeley	Comedy	NULL	UK
The Planter's Wife	/wiki/The_Planter%27s_Wife_(1952_film)	1952	Ken Annakin	Claudette Colbert, Jack Hawkins	Malyana Emergency Adventure/Drama	NULL	UK
The Ringer	/wiki/The_Ringer_(1952_film)	1952	Guy Hamilton	Herbert Lom, Denholm Elliott	Mystery	NULL	UK
Salute the Toff	/wiki/Salute_the_Toff	1952	Maclean Rogers	John Bentley, Carol Marsh	Crime	NULL	UK
Saturday Island	/wiki/Saturday_Island	1952	Stuart Heisler	Linda Darnell, Tab Hunter	Romance/War	NULL	UK
The Second Mrs Tanqueray	/wiki/The_Second_Mrs_Tanqueray_(1952_film)	1952	Dallas Bower	Pamela Brown, Hugh Sinclair	Drama	NULL	UK
Secret People	/wiki/Secret_People_(film)	1952	Thorold Dickinson	Audrey Hepburn, Valentina Cortese	Spy thriller	NULL	UK
Sing Along with Me	/wiki/Sing_Along_with_Me	1952	Peter Graham Scott	Donald Peers, Dodo Watts	Musical	NULL	UK
So Little Time	/wiki/So_Little_Time_(film)	1952	Compton Bennett	Marius Goring, Maria Schell	Romance	NULL	UK
Something Money Can't Buy	/wiki/Something_Money_Can%27t_Buy	1952	Pat Jackson	Patricia Roc, Anthony Steel	Comedy/Drama	NULL	UK
Song of Paris	/wiki/Song_of_Paris	1952	John Guillermin	Dennis Price, Anne Vernon	Comedy	NULL	UK
The Sound Barrier	/wiki/The_Sound_Barrier	1952	David Lean	Ralph Richardson, Ann Todd	Drama	NULL	UK
Stolen Face	/wiki/Stolen_Face	1952	Terence Fisher	Paul Henreid, Lizabeth Scott, André Morell	Drama	NULL	UK
The Stranger Left No Card	/wiki/The_Stranger_Left_No_Card	1952	Wendy Toye	Alan Badel, Geoffrey Bayldon, Eileen Way	Drama	NULL	UK
Top Secret	/wiki/Top_Secret_(1952_film)	1952	Mario Zampi	George Cole, Oskar Homolka	Comedy	NULL	UK
The Tall Headlines	/wiki/The_Tall_Headlines	1952	Terence Young	André Morell, Flora Robson	Crime	NULL	UK
Tread Softly	/wiki/Tread_Softly_(1952_film)	1952	David MacDonald	Frances Day, Patricia Dainton	Crime	NULL	UK
Treasure Hunt	/wiki/Treasure_Hunt_(1952_film)	1952	John Paddy Carstairs	Martita Hunt, Jimmy Edwards, Naunton Wayne	Comedy	NULL	UK
Trent's Last Case	/wiki/Trent%27s_Last_Case_(1952_film)	1952	Herbert Wilcox	Michael Wilding, Margaret Lockwood, Orson Welles	Detective	NULL	UK
Venetian Bird	/wiki/Venetian_Bird	1952	Ralph Thomas	Richard Todd, Eva Bartok	Mystery/Thriller	NULL	UK
The Voice of Merrill	/wiki/The_Voice_of_Merrill	1952	John Gilling	Valerie Hobson, James Robertson Justice	Mystery	NULL	UK
Where's Charley?	/wiki/Where%27s_Charley%3F_(film)	1952	David Butler	Ray Bolger, Allyn Ann McLerie	Musical	NULL	UK
Whispering Smith Hits London	/wiki/Whispering_Smith_Hits_London	1952	Francis Searle	Richard Carlson, Greta Gynt	Mystery	NULL	UK
Who Goes There!	/wiki/Who_Goes_There!	1952	Anthony Kimmins	Nigel Patrick, Valerie Hobson	Comedy	NULL	UK
Wide Boy	/wiki/Wide_Boy_(film)	1952	Ken Hughes	Sydney Tafler, Susan Shaw	Crime	NULL	UK
Wings of Danger	/wiki/Wings_of_Danger	1952	Terence Fisher	Zachary Scott, Robert Beatty	Thriller	NULL	UK
The Woman's Angle	/wiki/The_Woman%27s_Angle	1952	Leslie Arliss	Edward Underdown, Cathy O'Donnell	Drama	NULL	UK
Women of Twilight	/wiki/Women_of_Twilight	1952	Gordon Parry	René Ray, Lois Maxwell	Crime	NULL	UK
You're Only Young Twice	/wiki/You%27re_Only_Young_Twice_(film)	1952	Terry Bishop	Duncan Macrae, Joseph Tomelty	Comedy	NULL	UK
36 Hours	/wiki/36_Hours_(1953_film)	1953	Montgomery Tully	Dan Duryea, Elsie Albiin	Crime	NULL	UK
Albert R.N.	/wiki/Albert_R.N.	1953	Lewis Gilbert	Anthony Steel, Jack Warner, Robert Beatty	World War II/POW	NULL	UK
Appointment in London	/wiki/Appointment_in_London	1953	Philip Leacock	Dirk Bogarde, Ian Hunter, Dinah Sheridan	World War II	NULL	UK
Background	/wiki/Background_(1953_film)	1953	Daniel Birt	Valerie Hobson, Philip Friend	Drama	NULL	UK
Beat the Devil	/wiki/Beat_the_Devil_(film)	1953	John Huston	Humphrey Bogart, Jennifer Jones	Comedy/Thriller	NULL	UK
The Beggar's Opera	/wiki/The_Beggar%27s_Opera_(film)	1953	Peter Brook	Laurence Olivier, Hugh Griffith	Musical	NULL	UK
Black 13	/wiki/Black_13	1953	Ken Hughes	Peter Reynolds, Rona Anderson	Crime	NULL	UK
Black Orchid	/wiki/Black_Orchid_(1953_film)	1953	Charles Saunders	Ronald Howard, Olga Edwardes	Crime	NULL	UK
Blood Orange	/wiki/Blood_Orange_(film)	1953	Terence Fisher	Tom Conway, Mila Parély	Crime	NULL	UK
The Blue Parrot	/wiki/The_Blue_Parrot	1953	John Harlow	Dermot Walsh, Jacqueline Hill	Crime	NULL	UK
The Broken Horseshoe	/wiki/The_Broken_Horseshoe_(film)	1953	Martyn C. Webster	Robert Beatty, Elizabeth Sellers	Crime	NULL	UK
The Captain's Paradise	/wiki/The_Captain%27s_Paradise	1953	Anthony Kimmins	Alec Guinness, Celia Johnson, Yvonne De Carlo	Romantic comedy	NULL	UK
The Conquest of Everest	/wiki/The_Conquest_of_Everest	1953	George Lowe	Meredith Edwards (narrator)	Documentary	NULL	UK
Cosh Boy	/wiki/Cosh_Boy	1953	Lewis Gilbert	James Kenney, Joan Collins	Crime drama	NULL	UK
The Cruel Sea	/wiki/The_Cruel_Sea_(1953_film)	1953	Charles Frend	Jack Hawkins, Donald Sinden	World War II	NULL	UK
Deadly Nightshade	/wiki/Deadly_Nightshade_(film)	1953	John Gilling	Emrys Jones, Zena Marshall	Crime	NULL	UK
Decameron Nights	/wiki/Decameron_Nights	1953	Hugo Fregonese	Joan Fontaine, Louis Jourdan	Drama	NULL	UK
Desperate Moment	/wiki/Desperate_Moment	1953	Compton Bennett	Dirk Bogarde, Mai Zetterling	Thriller	NULL	UK
