77 Park Lane	/wiki/77_Park_Lane	1931	Albert de Courville	Dennis Neilson-Terry, Betty Stockfeld	Crime	NULL	UK
Alibi	/wiki/Alibi_(1931_film)	1931	Leslie S. Hiscott	Austin Trevor, Elizabeth Allan	Thriller	NULL	UK
Almost a Divorce	/wiki/Almost_a_Divorce	1931	Arthur Varney-Serrao	Marjorie Binner, Sydney Howard, Kay Hammond	Comedy	NULL	UK
The Bells	/wiki/The_Bells_(1931_film)	1931	Oscar M. Werndoff, Harcourt Templeman	Donald Calthrop, Jane Welsh	Drama	NULL	UK
Black Coffee	/wiki/Black_Coffee_(1931_film)	1931	Leslie S. Hiscott	Austin Trevor, Elizabeth Allan, Richard Cooper	Thriller	NULL	UK
Brown Sugar	/wiki/Brown_Sugar_(1931_film)	1931	Leslie S. Hiscott	Constance Carpenter, Francis Lister, Chili Bouchier	Drama	NULL	UK
The Calendar	/wiki/The_Calendar_(1931_film)	1931	T. Hayes Hunter	Herbert Marshall, Anne Grey, Gordon Harker, Nigel Bruce	Thriller	NULL	UK
Cape Forlorn	/wiki/Cape_Forlorn	1931	E.A. Dupont	Fay Compton, Frank Harvey, Ian Hunter, Donald Calthrop	Drama	NULL	UK
Carnival	/wiki/Carnival_(1931_film)	1931	Herbert Wilcox	Matheson Lang, Chili Bouchier, Joseph Schildkraut, Kay Hammond	Drama	NULL	UK
The Chance of a Night Time	/wiki/The_Chance_of_a_Night_Time	1931	Herbert Wilcox Ralph Lynn	Ralph Lynn, Winnifred Shotter, Sunday Wilshin, Kenneth Kove	Comedy	NULL	UK
City of Song	/wiki/City_of_Song	1931	Carmine Gallone	Jan Kiepura, Betty Stockfeld	Romance	NULL	UK
Contraband Love	/wiki/Contraband_Love	1931	Sidney Morgan	C. Aubrey Smith, Haddon Mason, Rosalinde Fuller	Adventure	NULL	UK
Dangerous Seas	/wiki/Dangerous_Seas	1931	Edward Dryhurst	Sandy Irving, Julie Suedo, Gerald Rawlinson	Drama	NULL	UK
Deadlock	/wiki/Deadlock_(1931_film)	1931	George King	Stewart Rome, Marjorie Hume, Esmond Knight	Thriller	NULL	UK
Down River	/wiki/Down_River	1931	Peter Godfrey	Charles Laughton, Jane Baxter, Harold Huth	Thriller	NULL	UK
Dreyfus	/wiki/Dreyfus_(1931_film)	1931	F.W. Kraemer	Cedric Hardwicke, George Merritt, Garry Marsh	Drama	NULL	UK
East Lynne on the Western Front	/wiki/East_Lynne_on_the_Western_Front	1931	George Pearson	Herbert Mundin, Alf Goddard	Comedy	NULL	UK
The Eternal Feminine	/wiki/The_Eternal_Feminine	1931	Arthur Varney-Serrao	Terence De Marney, Guy Newall, Jill Esmond	Romantic Comedy	NULL	UK
Fascination	/wiki/Fascination_(1931_film)	1931	Miles Mander	Madeleine Carroll, Carl Harbord, Kay Hammond	Romantic Drama	NULL	UK
The Flying Fool	/wiki/The_Flying_Fool_(1931_film)	1931	Walter Summers	Henry Kendall, Benita Hume	Thriller	NULL	UK
The Ghost Train	/wiki/The_Ghost_Train_(1931_film)	1931	Walter Forde	Jack Hulbert, Cicely Courtneidge	Comedy/Mystery	Adapted from Arnold Ridley's The Ghost Train	UK
Glamour	/wiki/Glamour_(1931_film)	1931	Seymour Hicks and Harry Hughes	Seymour Hicks, Ellaline Terriss, Margot Grahame	Romantic Drama	NULL	UK
The Great Gay Road	/wiki/The_Great_Gay_Road_(1931_film)	1931	Sinclair Hill	Stewart Rome, Frank Stanmore	Drama	NULL	UK
Guilt	/wiki/Guilt_(1931_film)	1931	Reginald Fogwell	James Carew, Anne Grey, Harold Huth	Romance	NULL	UK
Hindle Wakes	/wiki/Hindle_Wakes_(1931_film)	1931	Victor Saville	Belle Chrystall, John Stuart	Drama	NULL	UK
Hobson's Choice	/wiki/Hobson%27s_Choice_(1931_film)	1931	Thomas Bentley	James Harcourt, Viola Lyel	Comedy/Drama	NULL	UK
A Honeymoon Adventure	/wiki/A_Honeymoon_Adventure	1931	Maurice Elvey	Benita Hume, Peter Hannen	Crime	NULL	UK
The House Opposite	/wiki/The_House_Opposite_(1931_film)	1931	Walter Summers	Henry Kendall, Frank Stanmore	Crime	NULL	UK
Inquest	/wiki/Inquest_(1931_British_film)	1931	G. B. Samuelson	Campbell Gullan, Mary Glynne	Crime	NULL	UK
Jealousy	/wiki/Jealousy_(1931_film)	1931	G. B. Samuelson	Lilian Oldland, Malcolm Keen, Harold French	Drama	NULL	UK
Keepers of Youth	/wiki/Keepers_of_Youth	1931	Thomas Bentley	Garry Marsh, Ann Todd	Drama	NULL	UK
Let's Love and Laugh	/wiki/Let%27s_Love_and_Laugh	1931	Richard Eichberg	Gene Gerrard, Muriel Angelus	Comedy	NULL	UK
The Lyons Mail	/wiki/The_Lyons_Mail	1931	Arthur Maude	John Martin Harvey, Norah Baring	Mystery	NULL	UK
Madame Guillotine	/wiki/Madame_Guillotine	1931	Reginald Fogwell	Madeleine Carroll, Brian Aherne	Historical	NULL	UK
A Man of Mayfair	/wiki/A_Man_of_Mayfair	1931	Louis Mercanton	Jack Buchanan, Joan Barry, Warwick Ward	Musical Comedy	NULL	UK
The Man They Couldn't Arrest	/wiki/The_Man_They_Couldn%27t_Arrest	1931	T. Hayes Hunter	Hugh Wakefield, Gordon Harker	Drama	NULL	UK
Many Waters	/wiki/Many_Waters_(film)	1931	Milton Rosmer	Lillian Hall-Davis, Arthur Margetson	Romance	NULL	UK
Mary	/wiki/Mary_(1931_film)	1931	Alfred Hitchcock	Alfred Abel, Olga Tschechowa	Mystery/Thriller	The German-language version of Hitchcock's Murder!	UK
Men Like These	/wiki/Men_Like_These	1931	Walter Summers	Sydney Seaward, Syd Crossley	Adventure	NULL	UK
Michael and Mary	/wiki/Michael_and_Mary	1931	Victor Saville	Herbert Marshall, Edna Best	Drama	NULL	UK
Night in Montmartre	/wiki/Night_in_Montmartre	1931	Leslie S. Hiscott	Horace Hodges, Franklin Dyall	Mystery	NULL	UK
The Old Man	/wiki/The_Old_Man_(1931_film)	1931	H. Manning Haynes	Maisie Gay, Anne Grey	Mystery	NULL	UK
Old Soldiers Never Die	/wiki/Old_Soldiers_Never_Die	1931	Monty Banks	Leslie Fuller, Max Nesbitt	Comedy	NULL	UK
The Outsider	/wiki/The_Outsider_(1931_film)	1931	Harry Lachman	Joan Barry, Norman McKinnel	Drama	NULL	UK
Plunder	/wiki/Plunder_(1931_film)	1931	Tom Walls	Ralph Lynn, Winifred Shotter	Comedy	NULL	UK
Poor Old Bill	/wiki/Poor_Old_Bill	1931	Monty Banks	Leslie Fuller, Iris Ashley	Comedy	NULL	UK
Potiphar's Wife	/wiki/Potiphar%27s_Wife_(1931_film)	1931	Maurice Elvey	Nora Swinburne, Laurence Olivier	Romance	NULL	UK
Rich and Strange	/wiki/Rich_and_Strange	1931	Alfred Hitchcock	Henry Kendall, Joan Barry	Drama	NULL	UK
The Ringer	/wiki/The_Ringer_(1931_film)	1931	Walter Forde	Patrick Curwen, Esmond Knight	Crime	NULL	UK
Rodney Steps In	/wiki/Rodney_Steps_In	1931	Guy Newall	Richard Cooper, Elizabeth Allan	Comedy	NULL	UK
The Rosary	/wiki/The_Rosary_(film)	1931	Guy Newall	Margot Grahame, Elizabeth Allan	Drama	NULL	UK
Sally in Our Alley	/wiki/Sally_in_Our_Alley_(1931_film)	1931	Maurice Elvey	Gracie Fields, Ian Hunter	Comedy Drama	NULL	UK
Shadows	/wiki/Shadows_(1931_film)	1931	Alexander Esway	Jacqueline Logan, Bernard Nedell	Crime	NULL	UK
The Shadow Between	/wiki/The_Shadow_Between_(1931_film)	1931	Norman Walker	Godfrey Tearle, Kathleen O'Regan	Romance/Drama	NULL	UK
The Skin Game	/wiki/The_Skin_Game_(1931_film)	1931	Alfred Hitchcock	Edmund Gwenn, Helen Haye	Drama	NULL	UK
The Sleeping Cardinal	/wiki/The_Sleeping_Cardinal	1931	Leslie S. Hiscott	Arthur Wontner, Ian Fleming	Mystery	NULL	UK
The Speckled Band	/wiki/The_Speckled_Band_(1931_film)	1931	Jack Raymond	Raymond Massey, Lyn Harding	Mystery	NULL	UK
The Sport of Kings	/wiki/The_Sport_of_Kings_(film)	1931	Victor Saville	Leslie Henson, Hugh Wakefield, Gordon Harker	Comedy	NULL	UK
Stranglehold	/wiki/Stranglehold_(1931_film)	1931	Henry Edwards	Isobel Elsom, Garry Marsh	Drama	NULL	UK
The Stronger Sex	/wiki/The_Stronger_Sex	1931	Gareth Gundrey	Colin Clive, Adrianne Allen	Drama	NULL	UK
Sunshine Susie	/wiki/Sunshine_Susie	1931	Victor Saville	Renate Müller, Jack Hulbert	Musical	NULL	UK
Tell England	/wiki/Tell_England_(film)	1931	Anthony Asquith	Fay Compton, Tony Bruce	World War I Drama	NULL	UK
These Charming People	/wiki/These_Charming_People	1931	Louis Mercanton	Cyril Maude, Godfrey Tearle	Drama	NULL	UK
Third Time Lucky	/wiki/Third_Time_Lucky_(1931_film)	1931	Walter Forde	Bobby Howes, Dorothy Boyd	Comedy	NULL	UK
Tilly of Bloomsbury	/wiki/Tilly_of_Bloomsbury_(1931_film)	1931	Jack Raymond	Sydney Howard, Phyllis Konstam	Comedy	NULL	UK
To Oblige a Lady	/wiki/To_Oblige_a_Lady	1931	H. Manning Haynes	Masie Gay, Warwick Ward	Comedy	NULL	UK
Two Crowded Hours	/wiki/Two_Crowded_Hours	1931	Michael Powell	Jerry Verno	Comedy	NULL	UK
Uneasy Virtue	/wiki/Uneasy_Virtue	1931	Norman Walker	Fay Compton, Edmund Breon	Comedy	NULL	UK
Up for the Cup	/wiki/Up_for_the_Cup_(1931_film)	1931	Jack Raymond	Sydney Howard, Joan Wyndham	Comedy	NULL	UK
What a Night!	/wiki/What_a_Night!_(1931_film)	1931	Monty Banks	Leslie Fuller, Molly Lamont	Comedy	NULL	UK
Who Killed Doc Robin?	/wiki/Who_Killed_Doc_Robin%3F	1931	W.P. Kellino	Clifford Heatherley, Dorrie Deane	Comedy Short	NULL	UK
The Wickham Mystery	/wiki/The_Wickham_Mystery	1931	G. B. Samuelson	Wallace Bosco, Doris Clemence	Mystery	NULL	UK
The Woman Between	/wiki/The_Woman_Between_(1931_British_film)	1931	Miles Mander	Owen Nares, Adrianne Allen	Romance	NULL	UK
The Written Law	/wiki/The_Written_Law	1931	Reginald Fogwell	Madeleine Carroll, Percy Marmont	Drama	NULL	UK
The Wrong Mr. Perkins	/wiki/The_Wrong_Mr._Perkins	1931	Arthur Varney-Serrao	Herbert Mundin, Sonia Bellamy	Comedy Short	NULL	UK
Account Rendered	/wiki/Account_Rendered_(1932_film)	1932	Leslie Howard Gordon	Cecil Ramage, Reginald Bach	Crime Drama Short	NULL	UK
After Office Hours	/wiki/After_Office_Hours_(1932_film)	1932	Thomas Bentley	Viola Lyel, Heather Angel, Frank Lawton	Drama	NULL	UK
After the Ball	/wiki/After_the_Ball_(1932_film)	1932	Milton Rosmer	Esther Ralston, Basil Rathbone	Comedy	NULL	UK
Aren't We All?	/wiki/Aren%27t_We_All%3F_(film)	1932	Harry Lachman	Gertrude Lawrence, Owen Nares	Comedy	NULL	UK
Bachelor's Baby	/wiki/Bachelor%27s_Baby	1932	Harry Hughes	William Freshman, Henry Wenman, Alma Taylor	Comedy	NULL	UK
The Bad Companions	/wiki/The_Bad_Companions	1932	J.O.C. Orton	Nor Kiddie, Renee Gadd, Walter Lupino	Comedy Short	NULL	UK
The Barton Mystery	/wiki/The_Barton_Mystery_(1932_film)	1932	Henry Edwards	Ursula Jeans, Lyn Harding, Wendy Barrie	Thriller	NULL	UK
Betrayal	/wiki/Betrayal_(1932_film)	1932	Reginald Fogwell	Stewart Rome, Marjorie Hume	Drama	NULL	UK
The Blue Danube	/wiki/The_Blue_Danube_(1932_film)	1932	Herbert Wilcox	Brigitte Helm, Joseph Schildkraut	Romance	NULL	UK
Brother Alfred	/wiki/Brother_Alfred	1932	Henry Edwards	Gene Gerrard, Molly Lamont	Comedy	NULL	UK
Carmen	/wiki/Carmen_(1932_film)	1932	Cecil Lewis	Marguerite Namara, Thomas F. Burke	Musical	Based on Bizet's Carmen. Alternative title Gipsy Blood.	UK
Castle Sinister	/wiki/Castle_Sinister	1932	Widgey R. Newman	Haddon Mason, Isla Kilpatrick, Wally Patch	Horror	NULL	UK
The Chinese Puzzle	/wiki/The_Chinese_Puzzle_(1932_film)	1932	Guy Newall	Leon M. Lion, Elizabeth Allan, Austin Trevor	Drama	NULL	UK
C.O.D.	/wiki/C.O.D._(film)	1932	Michael Powell	Garry Marsh, Hope Davey	Thriller	NULL	UK
Condemned to Death	/wiki/Condemned_to_Death	1932	Walter Forde	Arthur Wontner, Gillian Lind	Crime	NULL	UK
Dance Pretty Lady	/wiki/Dance_Pretty_Lady	1932	Anthony Asquith	Anne Casson, Moore Marriott, Flora Robson	Drama	NULL	UK
Detective Lloyd	/wiki/Detective_Lloyd	1932	Henry MacRae Ray Taylor	Jack Lloyd, Muriel Angelus	Drama	12 part Movie serial	UK
Diamond Cut Diamond	/wiki/Diamond_Cut_Diamond_(film)	1932	Fred Niblo Maurice Elvey	Adolphe Menjou, Claud Allister	Comedy	NULL	UK
Don't Be a Dummy	/wiki/Don%27t_Be_a_Dummy	1932	Frank Richardson	Georgie Harris, Garry Marsh, Muriel Angelus	Drama	NULL	UK
Double Dealing	/wiki/Double_Dealing_(1932_film)	1932	Leslie S. Hiscott	Frank Pettingell, Richard Cooper, Zoe Palmer	Comedy	NULL	UK
Down Our Street	/wiki/Down_Our_Street	1932	Harry Lachman	Elizabeth Allan, Hugh Williams, Binnie Barnes	Drama	NULL	UK
Ebb Tide	/wiki/Ebb_Tide_(1932_film)	1932	Arthur Rosson	Chili Bouchier, George Barraud	Drama	NULL	UK
The Face at the Window	/wiki/The_Face_at_the_Window_(1932_film)	1932	Leslie S. Hiscott	Raymond Massey, Isla Bevan, Claude Hulbert	Thriller	NULL	UK
The Faithful Heart	/wiki/The_Faithful_Heart_(1932_film)	1932	Victor Saville	Herbert Marshall, Edna Best, Anne Grey	Romantic Drama	NULL	UK
Fires of Fate	/wiki/Fires_of_Fate_(1932_film)	1932	Norman Walker	Lester Matthews, Dorothy Bartlam, Donald Calthrop	Romantic Drama	NULL	UK
The First Mrs. Fraser	/wiki/The_First_Mrs._Fraser_(1932_film)	1932	Sinclair Hill	Joan Barry, Henry Ainley, Harold Huth	Romantic Drama	NULL	UK
The Flag Lieutenant	/wiki/The_Flag_Lieutenant_(1932_film)	1932	Henry Edwards	Henry Edwards, Anna Neagle	War	NULL	UK
The Flying Squad	/wiki/The_Flying_Squad_(1932_film)	1932	F. W. Kraemer	Carol Goodner, Harold Huth, Henry Wilcoxen	Thriller	NULL	UK
Frail Women	/wiki/Frail_Women	1932	Maurice Elvey	Mary Newcomb, Owen Nares	Drama	NULL	UK
The Frightened Lady	/wiki/The_Frightened_Lady_(1932_film)	1932	T. Hayes Hunter,	Emlyn Williams, Cathleen Nesbitt	Thriller	NULL	UK
For the Love of Mike	/wiki/For_the_Love_of_Mike_(1932_film)	1932	Monty Banks	Bobby Howes, Constance Shotter	Musical Comedy	NULL	UK
Goodnight, Vienna	/wiki/Goodnight,_Vienna	1932	Herbert Wilcox	Jack Buchanan, Anna Neagle, Gina Malo	Musical	NULL	UK
Help Yourself	/wiki/Help_Yourself_(film)	1932	Jean Daumery	Benita Hume, Martin Walker	Comedy	NULL	UK
Her Night Out	/wiki/Her_Night_Out	1932	William C. McGann	Dorothy Bartlam, Lester Matthews	Comedy	NULL	UK
His Lordship	/wiki/His_Lordship	1932	Michael Powell	Jerry Verno, Janet McGrew	Comedy	NULL	UK
Hotel Splendide	/wiki/Hotel_Splendide_(1932_film)	1932	Michael Powell	Jerry Verno, Anthony Holles	Crime	NULL	UK
The Impassive Footman	/wiki/The_Impassive_Footman	1932	Basil Dean	Owen Nares, Betty Stockfeld, Allan Jeayes	Drama	NULL	UK
Jack's the Boy	/wiki/Jack%27s_the_Boy	1932	Walter Forde	Jack Hulbert, Cicely Courtneidge	Comedy	NULL	UK
The Last Coupon	/wiki/The_Last_Coupon	1932	Frank Launder	Leslie Fuller, Mary Jerrold	Comedy	NULL	UK
Leap Year	/wiki/Leap_Year_(1932_film)	1932	Tom Walls	Tom Walls, Anne Grey, Edmund Breon	Comedy	NULL	UK
The Lodger	/wiki/The_Lodger_(1932_film)	1932	Maurice Elvey	Ivor Novello, Elizabeth Allan	Thriller	NULL	UK
Looking on the Bright Side	/wiki/Looking_on_the_Bright_Side	1932	Graham Cutts, Basil Dean	Gracie Fields, Richard Dolman	Comedy	NULL	UK
Lord Babs	/wiki/Lord_Babs	1932	Walter Forde	Bobby Howes, Jean Colin	Comedy	NULL	UK
Lord Camber's Ladies	/wiki/Lord_Camber%27s_Ladies	1932	Benn W. Levy	Gerald du Maurier, Gertrude Lawrence, Benita Hume	Drama	NULL	UK
The Love Contract	/wiki/The_Love_Contract	1932	Herbert Selpin	Winifred Shotter, Owen Nares	Musical	NULL	UK
Love on the Spot	/wiki/Love_on_the_Spot	1932	Graham Cutts	Rosemary Ames, Richard Dolman	Musical	NULL	UK
Love on Wheels	/wiki/Love_on_Wheels	1932	Victor Saville	Jack Hulbert, Leonora Corbett, Gordon Harker	Musical/Comedy	NULL	UK
The Lucky Number	/wiki/The_Lucky_Number	1932	Anthony Asquith	Clifford Mollison, Gordon Harker	Comedy	NULL	UK
Lucky Ladies	/wiki/Lucky_Ladies	1932	John Rawlins	Sydney Fairbrother, Emily Fitzroy	Comedy	NULL	UK
The Marriage Bond	/wiki/The_Marriage_Bond_(1932_film)	1932	Maurice Elvey	Mary Newcomb, Guy Newall	Drama	NULL	UK
Marry Me	/wiki/Marry_Me_(1932_film)	1932	Wilhelm Thiele	Renate Müller, Harry Green	Musical/Comedy	NULL	UK
The Mayor's Nest	/wiki/The_Mayor%27s_Nest	1932	Maclean Rogers	Sydney Howard, Claude Hulbert	Comedy	NULL	UK
Men of Steel	/wiki/Men_of_Steel_(film)	1932	George King	John Stuart, Benita Hume	Drama	NULL	UK
Men of Tomorrow	/wiki/Men_of_Tomorrow	1932	Zoltan Korda	Emlyn Williams, Robert Donat, Merle Oberon	Drama	NULL	UK
The Midshipmaid	/wiki/The_Midshipmaid	1932	Albert de Courville	Jessie Matthews, Basil Sydney	Comedy	NULL	UK
The Missing Rembrandt	/wiki/The_Missing_Rembrandt	1932	Leslie S. Hiscott	Arthur Wontner, Jane Welsh	Mystery	NULL	UK
Money Means Nothing	/wiki/Money_Means_Nothing	1932	Herbert Wilcox	John Loder, Irene Richards	Comedy	NULL	UK
Murder on the Second Floor	/wiki/Murder_on_the_Second_Floor	1932	William C. McGann	Pat Peterson, John Longden	Thriller	NULL	UK
My Friend the King	/wiki/My_Friend_the_King	1932	Michael Powell	Jerry Verno	Comedy	NULL	UK
Nine till Six	/wiki/Nine_till_Six	1932	Basil Dean	Florence Desmond, Elizabeth Allan	Drama	NULL	UK
Number Seventeen	/wiki/Number_Seventeen	1932	Alfred Hitchcock	John Stuart, Anne Grey, Leon M. Lion	Crime	NULL	UK
Old Spanish Customers	/wiki/Old_Spanish_Customers	1932	Lupino Lane	Leslie Fuller, Binnie Barnes	Comedy	NULL	UK
Partners Please	/wiki/Partners_Please	1932	Lloyd Richards	Pat Paterson, Tony Sympson	Comedy Short	NULL	UK
The Right to Live	/wiki/The_Right_to_Live	1932	Albert Parker	Davy Burnaby, Pat Person	Crime	NULL	UK
The River House Ghost	/wiki/The_River_House_Ghost	1932	Frank Richardson	Florence Desmond, Hal Walters	Comedy/Crime	NULL	UK
Rome Express	/wiki/Rome_Express	1932	Walter Forde	Conrad Veidt, Gordon Harker	Thriller	NULL	UK
Rynox	/wiki/Rynox	1932	Michael Powell	Stewart Rome, John Longden	Crime	NULL	UK
A Safe Proposition	/wiki/A_Safe_Proposition	1932	Leslie S. Hiscott	A. W. Baskcomb, Barbara Gott, Harold French	Comedy Short	NULL	UK
Sally Bishop	/wiki/Sally_Bishop_(1932_film)	1932	T. Hayes Hunter	Joan Barry, Harold Huth	Romance/Drama	NULL	UK
Service for Ladies	/wiki/Service_for_Ladies	1932	Alexander Korda	Leslie Howard, Elizabeth Allan	Comedy	NULL	UK
The Sign of Four	/wiki/The_Sign_of_Four_(1932_film)	1932	Graham Cutts	Arthur Wontner, Isla Bevan	Crime	NULL	UK
The Silver Greyhound	/wiki/The_Silver_Greyhound_(1932_film)	1932	William C. McGann	Percy Marmont, Anthony Bushell	Crime	NULL	UK
Sleepless Nights	/wiki/Sleepless_Nights_(1932_film)	1932	Thomas Bentley	Stanley Lupino, Polly Walker	Musical	NULL	UK
The Spare Room	/wiki/The_Spare_Room_(film)	1932	Redd Davis	Jimmy James, Ruth Taylor	Comedy Short	NULL	UK
The Star Reporter	/wiki/The_Star_Reporter	1932	Michael Powell	Harold French, Garry Marsh	Crime	NULL	UK
Thark	/wiki/Thark_(film)	1932	Tom Walls	Tom Walls, Ralph Lynn	Comedy	NULL	UK
That Night in London	/wiki/That_Night_in_London	1932	Rowland V. Lee	Robert Donat, Pearl Argyle	Crime	NULL	UK
There Goes The Bride	/wiki/There_Goes_the_Bride_(1932_film)	1932	Albert de Courville	Jessie Matthews, Owen Nares	Comedy	NULL	UK
Watch Beverly	/wiki/Watch_Beverly	1932	Arthur Maude	Henry Kendall, Dorothy Bartlam	Comedy	NULL	UK
The Water Gipsies	/wiki/The_Water_Gipsies_(film)	1932	Maurice Elvey	Ann Todd, Sari Maritza	Drama	NULL	UK
White Face	/wiki/White_Face	1932	T. Hayes Hunter	Hugh Williams, Gordon Harker and Renee Gadd	Crime	NULL	UK
The Wonderful Story	/wiki/The_Wonderful_Story_(1932_film)	1932	Reginald Fogwell	Wyn Clare, John Batten	Drama	NULL	UK
The World, the Flesh, the Devil	/wiki/The_World,_the_Flesh,_the_Devil	1932	George A. Cooper	Harold Huth, Isla Bevan	Drama	NULL	UK
Adventures of Don Quixote	/wiki/Don_Quixote_(1933_film)	1933	G.W. Pabst	Feodor Chaliapin, George Robey	Adventure	co-produced with France	UK
Anne One Hundred	/wiki/Anne_One_Hundred	1933	Henry Edwards	Betty Stockfeld, Gyles Isham	Romantic Drama	NULL	UK
As Good as New	/wiki/As_Good_as_New_(film)	1933	Graham Cutts	Winna Winifried, Sunday Wilshin	Drama	NULL	UK
Ask Beccles	/wiki/Ask_Beccles	1933	Redd Davis	Garry Marsh, Mary Newland	Comedy Thriller	NULL	UK
Aunt Sally	/wiki/Aunt_Sally_(film)	1933	Tim Whelan	Cicely Courtneidge, Sam Hardy	Musical Comedy	NULL	UK
The Bermondsey Kid	/wiki/The_Bermondsey_Kid	1933	Ralph Dawson	Esmond Knight, Eve Gray	Drama	NULL	UK
Bitter Sweet	/wiki/Bitter_Sweet_(1933_film)	1933	Herbert Wilcox	Anna Neagle, Fernand Gravey	Musical	NULL	UK
The Blarney Stone	/wiki/The_Blarney_Stone_(film)	1933	Tom Walls	Tom Walls, Robert Douglas, Anne Grey	Comedy Drama	NULL	UK
Born Lucky	/wiki/Born_Lucky_(film)	1933	Michael Powell	René Ray, John Longden	Musical Comedy	NULL	UK
Britannia of Billingsgate	/wiki/Britannia_of_Billingsgate	1933	Sinclair Hill	Violet Loraine, Gordon Harker	Musical Comedy	NULL	UK
Cash	/wiki/Cash_(1933_film)	1933	Zoltan Korda	Edmund Gwenn, Robert Donat, Wendy Barrie	Comedy	NULL	UK
Channel Crossing	/wiki/Channel_Crossing	1933	Milton Rosmer	Matheson Lang, Constance Cummings	Crime	NULL	UK
Commissionaire	/wiki/Commissionaire_(film)	1933	Edward Dryhurst	Sam Livesey, Barry Livesey	Crime	NULL	UK
The Constant Nymph	/wiki/The_Constant_Nymph_(1933_film)	1933	Basil Dean	Victoria Hopper, Brian Aherne	Drama	NULL	UK
Counsel's Opinion	/wiki/Counsel%27s_Opinion	1933	Allan Dwan	Henry Kendall, Binnie Barnes	Romantic Comedy	NULL	UK
The Crime at Blossoms	/wiki/The_Crime_at_Blossoms	1933	Maclean Rogers	Hugh Wakefield, Joyce Bland	Crime	NULL	UK
Dick Turpin	/wiki/Dick_Turpin_(1933_film)	1933	Victor Hanbury John Stafford	Victor McLaglen, Jane Carr	Historical/Drama	NULL	UK
Discord	/wiki/Discord_(film)	1933	Henry Edwards	Owen Nares, Benita Hume	Drama	NULL	UK
Excess Baggage	/wiki/Excess_Baggage_(1933_film)	1933	Redd Davis	Claud Allister, Frank Pettingell	Comedy	NULL	UK
Falling for You	/wiki/Falling_for_You_(1933_film)	1933	Jack Hulbert, Robert Stevenson	Jack Hulbert, Cicely Courtneidge	Comedy	NULL	UK
Follow the Lady	/wiki/Follow_the_Lady_(film)	1933	Adrian Brunel	Marguerite Allan, William Hartnell	Comedy	NULL	UK
The Fortunate Fool	/wiki/The_Fortunate_Fool	1933	Norman Walker	Hugh Wakefield, Joan Wyndham	Comedy	NULL	UK
Friday the Thirteenth	/wiki/Friday_the_Thirteenth_(1933_film)	1933	Victor Saville	Jessie Matthews, Sonnie Hale	Drama	NULL	UK
The Ghost Camera	/wiki/The_Ghost_Camera	1933	Bernard Vorhaus	Henry Kendall, Ida Lupino, John Mills	Mystery	NULL	UK
The Ghoul	/wiki/The_Ghoul_(1933_film)	1933	T. Hayes Hunter	Boris Karloff, Cedric Hardwicke	Horror	NULL	UK
The Girl from Maxim's	/wiki/The_Girl_from_Maxim%27s	1933	Alexander Korda	Leslie Henson, Frances Day	Musical Comedy	NULL	UK
The Good Companions	/wiki/The_Good_Companions_(1933_film)	1933	Victor Saville	Jessie Matthews, Edmund Gwenn	Musical	NULL	UK
Great Stuff	/wiki/Great_Stuff	1933	Leslie S. Hiscott	Henry Kendall, Betty Astell	Comedy	NULL	UK
Hawley's of High Street	/wiki/Hawley%27s_of_High_Street	1933	Thomas Bentley	Leslie Fuller, Judy Kelly, Francis Lister	Drama	NULL	UK
Her Imaginary Lover	/wiki/Her_Imaginary_Lover	1933	George King	Laura La Plante, Percy Marmont	Comedy	NULL	UK
High Finance	/wiki/High_Finance_(film)	1933	George King	Gibb McLaughlin, Ida Lupino	Drama	NULL	UK
The House of Trent	/wiki/The_House_of_Trent	1933	Norman Walker	Anne Grey, Wendy Barrie	Drama	NULL	UK
I Adore You	/wiki/I_Adore_You_(film)	1933	George King	Margot Grahame, Harold French	Comedy/Musical	NULL	UK
I Lived with You	/wiki/I_Lived_with_You	1933	Maurice Elvey	Ivor Novello, Ursula Jeans	Romance/Comedy	NULL	UK
I Was a Spy	/wiki/I_Was_a_Spy	1933	Victor Saville	Madeleine Carroll, Conrad Veidt	Thriller	NULL	UK
I'll Stick to You	/wiki/I%27ll_Stick_to_You	1933	Leslie Hiscott	Jay Laurier, Betty Astell	Comedy	NULL	UK
I'm an Explosive	/wiki/I%27m_an_Explosive	1933	Adrian Brunel	William Hartnell, Gladys Jennings	Comedy	NULL	UK
It's a Boy	/wiki/It%27s_a_Boy_(film)	1933	Tim Whelan	Leslie Henson, Albert Burdon	Comedy	NULL	UK
The Jewel	/wiki/The_Jewel_(1933_film)	1933	Reginald Denham	Hugh Williams, Jack Hawkins	Crime	NULL	UK
Just My Luck	/wiki/Just_My_Luck_(1933_film)	1933	Jack Raymond	Ralph Lynn, Winifred Shotter	Comedy	NULL	UK
Keep It Quiet	/wiki/Keep_It_Quiet	1933	Leslie S. Hiscott	Bertha Belmore, Davy Burnaby	Crime	NULL	UK
King of the Ritz	/wiki/King_of_the_Ritz	1933	Carmine Gallone, Herbert Smith	Stanley Lupino, Betty Stockfeld	Musical	NULL	UK
The King's Cup	/wiki/The_King%27s_Cup	1933	Alan Cobham	Robert Cullen, Harry Milton, William Kendall	Drama	NULL	UK
La dame de chez Maxim's	/wiki/La_dame_de_chez_Maxim%27s_(1933_film)	1933	Alexander Korda	Florelle, André Lefaur	Comedy	French-language version of The Girl from Maxim's	UK
The Laughter of Fools	/wiki/The_Laughter_of_Fools	1933	Adrian Brunel	Derrick De Marney, Helen Ferrers	Drama	NULL	UK
Leave It to Smith	/wiki/Leave_It_to_Smith	1933	Tom Walls	Tom Walls, Carol Goodner	Comedy	NULL	UK
Letting in the Sunshine	/wiki/Letting_in_the_Sunshine	1933	Lupino Lane	Albert Burdon, Renee Gadd	Comedy	NULL	UK
The Little Damozel	/wiki/The_Little_Damozel_(1933_film)	1933	Herbert Wilcox	Anna Neagle, James Rennie (actor)	Romance	NULL	UK
The Lost Chord	/wiki/The_Lost_Chord_(film)	1933	Maurice Elvey	John Stuart, Elizabeth Allan	Drama	NULL	UK
The Love Nest	/wiki/The_Love_Nest_(1933_film)	1933	Thomas Bentley	Gene Gerrard, Camilla Horn	Comedy	NULL	UK
Loyalties	/wiki/Loyalties_(1933_film)	1933	Basil Dean	Basil Rathbone, Heather Thatcher	Drama	NULL	UK
The Lure	/wiki/The_Lure	1933	Arthur Maude	Anne Grey, Cyril Raymond	Crime	NULL	UK
The Man from Toronto	/wiki/The_Man_from_Toronto	1933	Sinclair Hill	Jessie Matthews, Ian Hunter	Romance	NULL	UK
Matinee Idol	/wiki/Matinee_Idol_(film)	1933	George King	Camilla Horn, Miles Mander	Crime	NULL	UK
Mayfair Girl	/wiki/Mayfair_Girl	1933	George King	Sally Blane, John Stuart	Crime	NULL	UK
The Medicine Man	/wiki/The_Medicine_Man_(1933_film)	1933	Redd Davis	Claud Allister, Frank Pettingell	Comedy	NULL	UK
Meet My Sister	/wiki/Meet_My_Sister	1933	Jean Daumery	Clifford Mollison, Constance Shotter	Comedy	NULL	UK
The Melody-Maker	/wiki/The_Melody-Maker	1933	Leslie S. Hiscott	Lester Matthews, Joan Marion	Comedy/Musical	NULL	UK
Money for Speed	/wiki/Money_for_Speed	1933	Bernard Vorhaus	John Loder, Ida Lupino	Drama	NULL	UK
No Funny Business	/wiki/No_Funny_Business	1933	Victor Hanbury	Laurence Olivier, Gertrude Lawrence	Comedy	NULL	UK
Perfect Understanding	/wiki/Perfect_Understanding	1933	Cyril Gardner	Gloria Swanson, Laurence Olivier	Comedy/Romance	NULL	UK
The Pride of the Force	/wiki/The_Pride_of_the_Force	1933	Norman Lee	Patrick Aherne, Leslie Fuller	Comedy	NULL	UK
Prince of Arcadia	/wiki/Prince_of_Arcadia	1933	Hanns Schwarz	Carl Brisson, Margot Grahame	Musical	NULL	UK
The Private Life of Henry VIII	/wiki/The_Private_Life_of_Henry_VIII	1933	Alexander Korda	Charles Laughton, Robert Donat, Merle Oberon, Elsa Lanchester	Historical Drama	Academy Award for Best Actor (Laughton)	UK
Puppets of Fate	/wiki/Puppets_of_Fate	1933	George A. Cooper	Godfrey Tearle, Isla Bevan	Crime	NULL	UK
The Return of Raffles	/wiki/The_Return_of_Raffles	1933	Mansfield Markham	George Barraud, Camilla Horn	Crime	NULL	UK
The Roof	/wiki/The_Roof_(1933_film)	1933	George A. Cooper	Leslie Perrins, Judy Gunn	Crime	NULL	UK
A Shot in the Dark	/wiki/A_Shot_in_the_Dark_(1933_film)	1933	George Pearson	Dorothy Boyd, Jack Hawkins, O. B. Clarence	Mystery	NULL	UK
Sleeping Car	/wiki/Sleeping_Car_(film)	1933	Anatole Litvak	Madeleine Carroll, Ivor Novello	Comedy	NULL	UK
Soldiers of the King	/wiki/Soldiers_of_the_King_(film)	1933	Maurice Elvey	Cicely Courtneidge, Edward Everett Horton	Comedy	NULL	UK
