The Claim	/wiki/The_Claim	2000	Michael Winterbottom	Peter Mullan, Milla Jovovich	Western/Romance	NULL	UK
Complicity	/wiki/Complicity_(film)	2000	Gavin Millar	Jonny Lee Miller, Brian Cox	Drama	NULL	UK
Essex Boys	/wiki/Essex_Boys	2000	Terry Winsor	Sean Bean, Alex Kingston	Crime drama	NULL	UK
Esther Kahn	/wiki/Esther_Kahn	2000	Arnaud Desplechin	Summer Phoenix, Ian Holm, Fabrice Desplechin	Period drama	NULL	UK
Gangster No. 1	/wiki/Gangster_No._1	2000	Paul McGuigan	Malcolm McDowell, Paul Bettany	Crime drama	NULL	UK
Gladiator	/wiki/Gladiator_(2000_film)	2000	Ridley Scott	Russell Crowe, Oliver Reed	Drama	NULL	UK
The Golden Bowl	/wiki/The_Golden_Bowl_(film)	2000	James Ivory	Kate Beckinsale, James Fox	Literary drama	NULL	UK
Greenfingers	/wiki/Greenfingers	2000	Joel Hershman	Helen Mirren, Clive Owen	Comedy	NULL	UK
Honest	/wiki/Honest_(film)	2000	David A. Stewart	Peter Facinelli	Crime	Screened at Cannes	UK
Hotel Splendide	/wiki/Hotel_Splendide_(film)	2000	Terence Gross	Toni Collette, Daniel Craig	Comedy	NULL	UK
House!	/wiki/House!	2000	Julian Kemp	Kelly Macdonald, Jason Hughes	Comedy	NULL	UK
How to Kill Your Neighbor's Dog	/wiki/How_to_Kill_Your_Neighbor%27s_Dog	2000	Michael Kalesniko	Kenneth Branagh, Robin Wright Penn	Comedy	NULL	UK
Kevin & Perry Go Large	/wiki/Kevin_%26_Perry_Go_Large	2000	Ed Bye	Harry Enfield, Kathy Burke, Rhys Ifans	Comedy	TV spin-off	UK
Kiss Kiss (Bang Bang)	/wiki/Kiss_Kiss_(Bang_Bang)	2000	Stewart Sugg	Stellan Skarsgård, Chris Penn	Comedy	NULL	UK
Liam	/wiki/Liam_(film)	2000	Stephen Frears	Ian Hart, Claire Hackett, Anthony Borrows	Drama	NULL	UK
Love's Labour's Lost	/wiki/Love%27s_Labour%27s_Lost_(film)	2000	Kenneth Branagh	Kenneth Branagh, Nathan Lane, Adrian Lester	Shakespearean	NULL	UK
Love, Honour and Obey	/wiki/Love,_Honour_and_Obey	2000	Dominic Anciano, Ray Burdis	Jonny Lee Miller, Jude Law	Crime	NULL	UK
Mad About Mambo	/wiki/Mad_About_Mambo	2000	John Forte	William Ash, Keri Russell	Romantic comedy	Co-production with the Republic of Ireland	UK
The Man Who Cried	/wiki/The_Man_Who_Cried	2000	Sally Potter	Christina Ricci, Cate Blanchett, Johnny Depp	Drama	NULL	UK
Maybe Baby	/wiki/Maybe_Baby_(2000_film)	2000	Ben Elton	Hugh Laurie, Joely Richardson	Romantic comedy	NULL	UK
No Maps for These Territories	/wiki/No_Maps_for_These_Territories	2000	Mark Neale	William Gibson, Jack Womack	Documentary	NULL	UK
Nora	/wiki/Nora_(2000_film)	2000	Pat Murphy	Ewan McGregor, Susan Lynch	Drama	Co-production with Germany, Italy and the Republic of Ireland	UK
One of the Hollywood Ten	/wiki/One_of_the_Hollywood_Ten	2000	Karl Francis	Jeff Goldblum, Greta Scacchi	Drama	Co-production with Spain	UK
Pandaemonium	/wiki/Pandaemonium_(film)	2000	Julien Tempe	Linus Roache, John Hannah	Biopic	NULL	UK
Paranoid	/wiki/Paranoid_(2000_thriller_film)	2000	John Duigan	Jessica Alba, Iain Glen	Drama	NULL	UK
Purely Belter	/wiki/Purely_Belter	2000	Mark Herman	Chris Beattie, Greg McLane	Comedy/Drama	NULL	UK
Quills	/wiki/Quills	2000	Philip Kaufman	Geoffrey Rush, Kate Winslet, Joaquin Phoenix	Historical drama	NULL	UK
Relative Values	/wiki/Relative_Values_(film)	2000	Eric Styles	Julie Andrews, Colin Firth	Comedy	NULL	UK
Saving Grace	/wiki/Saving_Grace_(2000_film)	2000	Nigel Cole	Brenda Blethyn, Craig Ferguson	Comedy	NULL	UK
Sexy Beast	/wiki/Sexy_Beast	2000	Jonathan Glazer	Ray Winstone, Ben Kingsley	Crime/Thriller	NULL	UK
A Shot at Glory	/wiki/A_Shot_at_Glory	2000	Michael Corrente	Robert Duvall, Michael Keaton	Sport	NULL	UK
Snatch	/wiki/Snatch_(film)	2000	Guy Ritchie	Jason Statham, Stephen Graham, Brad Pitt	Heist/Thriller	NULL	UK
Some Voices	/wiki/Some_Voices_(film)	2000	Simon Cellan Jones	Daniel Craig, David Morrissey	Comedy/Drama	NULL	UK
There's Only One Jimmy Grimble	/wiki/There%27s_Only_One_Jimmy_Grimble	2000	John Hay	Lewis McKenzie, Gina McKee, Ray Winstone	Sports/Drama	NULL	UK
Up at the Villa	/wiki/Up_at_the_Villa	2000	Philip Haas	Kristin Scott Thomas, Sean Penn	Drama	NULL	UK
When the Sky Falls	/wiki/When_the_Sky_Falls	2000	John Mackenzie	Joan Allen, Patrick Bergin	Crime	Co-production with Republic of Ireland	UK
The 51st State	/wiki/The_51st_State	2001	Ronny Yu	Samuel L. Jackson, Robert Carlyle, Emily Mortimer, Ricky Tomlinson	Action/Crime	NULL	UK
Another Life	/wiki/Another_Life_(film)	2001	Philip Goodhew	Ioan Gruffudd, Natasha Little	Drama	NULL	UK
Back to the Secret Garden	/wiki/Back_to_the_Secret_Garden	2001	Michael Tuchner	Joan Plowright, George Baker	Family	NULL	UK
Beginner's Luck	/wiki/Beginner%27s_Luck_(2001_film)	2001	James Callis, Nick Cohen	Julie Delpy, Steven Berkoff	Drama	NULL	UK
Birthday Girl	/wiki/Birthday_Girl	2001	Jez Butterworth	Nicole Kidman, Ben Chaplin	Comedy/Drama	NULL	UK
Blow Dry	/wiki/Blow_Dry	2001	Paddy Breathnach	Alan Rickman, Natasha Richardson	Comedy	NULL	UK
Bride of the Wind	/wiki/Bride_of_the_Wind	2001	Bruce Beresford	Sarah Wynter, Jonathan Pryce	Historical drama	NULL	UK
Bridget Jones's Diary	/wiki/Bridget_Jones%27s_Diary_(film)	2001	Sharon Maguire	Renée Zellweger, Hugh Grant, Colin Firth	Comedy	NULL	UK
The Bunker	/wiki/The_Bunker_(2001_film)	2001	Rob Green	Jason Flemyng, Andrew Tiernan, Jack Davenport, Andrew Lee Potts	Drama	NULL	UK
Captain Corelli's Mandolin	/wiki/Captain_Corelli%27s_Mandolin_(film)	2001	John Madden	Nicolas Cage, Penélope Cruz	Drama	Co-production with France and the US	UK
The Cat's Meow	/wiki/The_Cat%27s_Meow	2001	Peter Bogdanovich	Kirsten Dunst, Cary Elwes, Eddie Izzard	Drama	Co-production with Germany and the United States	UK
Charlotte Gray	/wiki/Charlotte_Gray_(film)	2001	Gillian Armstrong	Cate Blanchett, Michael Gambon	Drama	NULL	UK
Christmas Carol: The Movie	/wiki/Christmas_Carol:_The_Movie	2001	Jimmy T. Murakami	Simon Callow, Kate Winslet, Nicolas Cage	Animation	NULL	UK
Cradle of Fear	/wiki/Cradle_of_Fear	2001	Alex Chandon	Dani Filth, Emily Booth	Horror	NULL	UK
Crush	/wiki/Crush_(2001_film)	2001	John McKay	Andie MacDowell, Imelda Staunton	Comedy/Drama	NULL	UK
The Emperor's New Clothes	/wiki/The_Emperor%27s_New_Clothes_(2001_film)	2001	Alan Taylor	Ian Holm, Iben Hjejle	Historical	NULL	UK
Enigma	/wiki/Enigma_(2001_film)	2001	Michael Apted	Dougray Scott, Kate Winslet, Jeremy Northam	World War II/Thriller	NULL	UK
The Fourth Angel	/wiki/The_Fourth_Angel	2001	John Irvin	Jeremy Irons, Forest Whitaker	Thriller	NULL	UK
Girl from Rio	/wiki/Girl_from_Rio	2001	Christopher Monger	Hugh Laurie, Vanessa Nunes	Romance	NULL	UK
Gosford Park	/wiki/Gosford_Park	2001	Robert Altman	Maggie Smith, Helen Mirren, Michael Gambon, Kristin Scott Thomas, Eileen Atkins, Clive Owen, Kelly Macdonald, Emily Watson	Drama	Winner of the Best Original Screenplay Academy Award.	UK
Harry Potter and the Philosopher's Stone	/wiki/Harry_Potter_and_the_Philosopher%27s_Stone_(film)	2001	Chris Columbus	Daniel Radcliffe, Rupert Grint, Emma Watson	Fantasy	NULL	UK
High Heels and Low Lifes	/wiki/High_Heels_and_Low_Lifes	2001	Mel Smith	Kevin McNally, Minnie Driver	Comedy/Action	NULL	UK
The Hole	/wiki/The_Hole_(2001_film)	2001	Nick Hamm	Thora Birch, Desmond Harrington	Horror	NULL	UK
Hotel	/wiki/Hotel_(2001_film)	2001	Mike Figgis	Saffron Burrows, Salma Hayek, Lucy Liu, Burt Reynolds	Drama	NULL	UK
Inferno	/wiki/Inferno_(2001_short)	2001	Paul Kousoulides	Emily Booth, Sanjeev Bhaskar	Sci Fi	Short film	UK
Iris	/wiki/Iris_(film)	2001	Richard Eyre	Judi Dench, Kate Winslet, Jim Broadbent	Biographical Drama	Winner of the Best Supporting Actor Academy Award	UK
Last Orders	/wiki/Last_Orders_(film)	2001	Fred Schepisi	Michael Caine, Tom Courtenay	Drama	NULL	UK
Late Night Shopping	/wiki/Late_Night_Shopping	2001	Saul Metzstein	Luke de Woolfson, James Lance	Drama	NULL	UK
The Luzhin Defence	/wiki/The_Luzhin_Defence	2001	Marleen Gorris	John Turturro, Emily Watson	Drama	NULL	UK
The Martins	/wiki/The_Martins_(film)	2001	Tony Grounds	Lee Evans, Kathy Burke	Comedy	NULL	UK
Me Without You	/wiki/Me_Without_You_(film)	2001	Sandra Goldbacher	Anna Friel, Michelle Williams	Drama	NULL	UK
Mean Machine	/wiki/Mean_Machine_(film)	2001	Barry Skolnick	Vinnie Jones, Jason Statham	Sports	A remake of the US film entitled The Longest Yard	UK
Mike Bassett: England Manager	/wiki/Mike_Bassett:_England_Manager	2001	Steve Barron	Ricky Tomlinson, Amanda Redman	Sports/Comedy	NULL	UK
My Kingdom	/wiki/My_Kingdom_(film)	2001	Don Boyd	Richard Harris, Lynn Redgrave	Crime	NULL	UK
Strictly Sinatra	/wiki/Strictly_Sinatra	2001	Peter Capaldi	Ian Hart, Kelly Macdonald	Drama	NULL	UK
The Triumph of Love	/wiki/The_Triumph_of_Love_(film)	2001	Clare Peploe	Mira Sorvino, Ben Kingsley	Comedy	Co-production with Italy and Germany	UK
24 Hour Party People	/wiki/24_Hour_Party_People	2002	Michael Winterbottom	Steve Coogan, Shirley Henderson, Paddy Considine, Ralf Little	Comedy/Drama	Manchester Party Culture, entered at Cannes	UK
28 Days Later	/wiki/28_Days_Later	2002	Danny Boyle	Cillian Murphy, Naomie Harris, Christopher Eccleston	Horror	NULL	UK
AKA	/wiki/AKA_(film)	2002	Duncan Roy	Matthew Leitch, Diana Quick, George Asprey	Drama	8 awards and nominations	UK
About a Boy	/wiki/About_a_Boy_(film)	2002	Chris Weitz	Hugh Grant, Nicholas Hoult, Toni Collette	Comedy	NULL	UK
Ali G Indahouse	/wiki/Ali_G_Indahouse	2002	Mark Mylod	Sacha Baron Cohen, Martin Freeman, Michael Gambon, Charles Dance	Comedy	NULL	UK
All or Nothing	/wiki/All_or_Nothing_(film)	2002	Mike Leigh	Timothy Spall, Sam Kelly	NULL	Entered into the 2002 Cannes Film Festival	UK
Anita and Me	/wiki/Anita_and_Me_(film)	2002	Metin Hüseyin	Chandeep Uppal, Kabir Bedi, Anna Brewster	Comedy/Drama	British Indian film	UK
Before You Go	/wiki/Before_You_Go_(film)	2002	Lewis Gilbert	Julie Walters, John Hannah	Comedy	NULL	UK
Bend It Like Beckham	/wiki/Bend_It_Like_Beckham	2002	Gurinder Chadha	Parminder Nagra, Keira Knightley, Jonathan Rhys Meyers	Drama/Sports	NULL	UK
Deathwatch	/wiki/Deathwatch_(2002_film)	2002	Michael J. Bassett	Jamie Bell, Laurence Fox	Horror	NULL	UK
Die Another Day	/wiki/Die_Another_Day	2002	Lee Tamahori	Pierce Brosnan, Halle Berry, John Cleese, Madonna	Spy, Action	Last James Bond film starring Brosnan	UK
Dirty Pretty Things	/wiki/Dirty_Pretty_Things_(film)	2002	Stephen Frears	Chiwetel Ejiofor	Drama	NULL	UK
Doctor Sleep	/wiki/Doctor_Sleep_(film)	2002	Nick Willing	Goran Visnjic, Shirley Henderson, Paddy Considine	Drama	NULL	UK
Dog Soldiers	/wiki/Dog_Soldiers_(film)	2002	Neil Marshall	Sean Pertwee, Kevin McKidd	Horror	NULL	UK
The Escapist	/wiki/The_Escapist_(2002_film)	2002	Gillies MacKinnon	Jonny Lee Miller, Andy Serkis	Thriller	NULL	UK
The Guru	/wiki/The_Guru_(2002_film)	2002	Daisy von Scherler Mayer	Jimi Mistry, Heather Graham, Marisa Tomei	Comedy	NULL	UK
Harry Potter and the Chamber of Secrets	/wiki/Harry_Potter_and_the_Chamber_of_Secrets_(film)	2002	Chris Columbus	Daniel Radcliffe, Rupert Grint, Emma Watson	Fantasy	NULL	UK
The Honeytrap	/wiki/The_Honeytrap	2002	Michael G. Gunther	Emily Lloyd, Valerie Edmond, Anthony Green, Ed Harris	Thriller	NULL	UK
The Hours	/wiki/The_Hours_(film)	2002	Stephen Daldry	Nicole Kidman, Meryl Streep, Julianne Moore, Ed Harris	Drama	NULL	UK
The Importance of Being Earnest	/wiki/The_Importance_of_Being_Earnest_(2002_film)	2002	Oliver Parker	Rupert Everett, Colin Firth, Judi Dench	Comedy	Adaptation of the play by Oscar Wilde	UK
In This World	/wiki/In_This_World	2002	Michael Winterbottom	Jamal Udin Torabi, Enayatullah	Drama	NULL	UK
The Last Great Wilderness	/wiki/The_Last_Great_Wilderness_(film)	2002	David Mackenzie	Alastair Mackenzie, Jonathan Phillips, Ewan Stewart, David Hayman, Victoria Smurfit	Dogme 95-esque thriller/Dark humour	NULL	UK
Long Time Dead	/wiki/Long_Time_Dead	2002	Marcus Adams	Joe Absolom, Lukas Haas	Horror	NULL	UK
The Magdalene Sisters	/wiki/The_Magdalene_Sisters	2002	Peter Mullan	Anne-Marie Duff, Nora Jane Noone, Geraldine McEwan	Drama	NULL	UK
Miranda	/wiki/Miranda_(2002_film)	2002	Marc Munden	Christina Ricci, John Simm	Romance/Comedy	NULL	UK
Morvern Callar	/wiki/Morvern_Callar_(film)	2002	Lynne Ramsay	Samantha Morton	Drama	NULL	UK
My Little Eye	/wiki/My_Little_Eye	2002	Marc Evans	Sean Cw Johnson, Kris Lemche	Horror	NULL	UK
My Wrongs #8245–8249 & 117	/wiki/My_Wrongs_8245%E2%80%938249_%26_117	2002	Chris Morris	Paddy Considine	Comedy	Short film	UK
Nicholas Nickleby	/wiki/Nicholas_Nickleby_(2002_film)	2002	Douglas McGrath	Charlie Hunnam, Nathan Lane, Jim Broadbent	Comedy drama	NULL	UK
Once Upon a Time in the Midlands	/wiki/Once_Upon_a_Time_in_the_Midlands	2002	Shane Meadows	Robert Carlyle, Shirley Henderson, Kathy Burke	Crime drama	NULL	UK
The One and Only	/wiki/The_One_and_Only_(2002_film)	2002	Simon Cellan Jones	Justine Waddell, Richard Roxburgh, Jonathan Cake	Comedy/Romance	NULL	UK
The Pianist	/wiki/The_Pianist_(2002_film)	2002	Roman Polanski	Adrien Brody, Frank Finlay	Drama	NULL	UK
Pure	/wiki/Pure_(2002_film)	2002	Gillies MacKinnon	David Wenham, Keira Knightley, Molly Parker	Drama	NULL	UK
Ripley's Game	/wiki/Ripley%27s_Game	2002	Liliana Cavani	John Malkovich, Dougray Scott	Crime	Co-production with Italy and the US	UK
Silent Cry	/wiki/Silent_Cry_(film)	2002	Julian Richards	Emily Woof, Douglas Henshall	Thriller	NULL	UK
Solid Geometry	/wiki/Solid_Geometry_(film)	2002	Denis Lawson	Ewan McGregor, Ruth Millar	Mystery	Short film	UK
The Soul Keeper	/wiki/The_Soul_Keeper	2002	Roberto Faenza	Emilia Fox, Iain Glen, Craig Ferguson	romance-drama	Italian-French-British co-production	UK
Spider	/wiki/Spider_(2002_film)	2002	David Cronenberg	Ralph Fiennes, Miranda Richardson, Gabriel Byrne	Psychological thriller	NULL	UK
Tomorrow La Scala!	/wiki/Tomorrow_La_Scala!	2002	Francesca Joseph	NULL	NULL	Screened at the 2002 Cannes Film Festival	UK
Two Men Went to War	/wiki/Two_Men_Went_to_War	2002	John Henderson	Kenneth Cranham.Leo Bill	World War II comedy	NULL	UK
Vacuuming Completely Nude in Paradise	/wiki/Vacuuming_Completely_Nude_in_Paradise	2002	Danny Boyle	Timothy Spall, Michael Begley	Comedy/Drama	NULL	UK
The Warrior	/wiki/The_Warrior_(2001_British_film)	2002	Asif Kapadia	Irrfan Khan	Adventure	Made in Hindi	UK
16 Years of Alcohol	/wiki/16_Years_of_Alcohol	2003	Richard Jobson	Kevin McKidd, Iain De Caesteker, Susan Lynch	Drama	NULL	UK
The Actors	/wiki/The_Actors	2003	Conor McPherson	Michael Caine, Dylan Moran	Comedy/Crime	NULL	UK
Baltic Storm	/wiki/Baltic_Storm	2003	Reuben Leder	Greta Scacchi, Jürgen Prochnow	Thriller	Co-production with Germany	UK
Blackball	/wiki/Blackball_(film)	2003	Mel Smith	Paul Kaye, Alice Evans	Comedy	NULL	UK
Bollywood Queen	/wiki/Bollywood_Queen	2003	Jeremy Wooding	Preeya Kalidas, James McAvoy	Musical	NULL	UK
Bright Young Things	/wiki/Bright_Young_Things	2003	Stephen Fry	Emily Mortimer, Stephen Campbell Moore	Period drama	NULL	UK
Calendar Girls	/wiki/Calendar_Girls	2003	Nigel Cole	Julie Walters, Helen Mirren	Drama	NULL	UK
Code 46	/wiki/Code_46	2003	Michael Winterbottom	Tim Robbins, Samantha Morton	Science fiction	NULL	UK
Cold Mountain	/wiki/Cold_Mountain_(film)	2003	Anthony Minghella	Jude Law, Nicole Kidman, Ray Winstone	War	Co-production with Romania, Italy and US	UK
Devil's Gate	/wiki/Devil%27s_Gate_(film)	2003	Stuart St. Paul	Laura Fraser, Callum Blue	Drama	NULL	UK
Festival Express	/wiki/Festival_Express	2003	Bob Smeaton	Janis Joplin, Grateful Dead, The Band	Documentary	NULL	UK
Game Over: Kasparov and the Machine	/wiki/Game_Over:_Kasparov_and_the_Machine	2003	Vikram Jayanti	Garry Kasparov	Documentary	NULL	UK
Girl with a Pearl Earring	/wiki/Girl_with_a_Pearl_Earring_(film)	2003	Peter Webber	Colin Firth, Scarlett Johansson, Tom Wilkinson	Drama	NULL	UK
The Gospel of John	/wiki/The_Gospel_of_John_(film)	2003	Philip Saville	Henry Ian Cusick, Stuart Bunce	Biblical	NULL	UK
The Heart of Me	/wiki/The_Heart_of_Me	2003	Thaddeus O'Sullivan	Helena Bonham Carter, Paul Bettany	Period drama	NULL	UK
Hope Springs	/wiki/Hope_Springs_(2003_film)	2003	Mark Herman	Colin Firth, Minnie Driver	Comedy	NULL	UK
Imagining Argentina	/wiki/Imagining_Argentina_(film)	2003	Christopher Hampton	Antonio Banderas, Emma Thompson	Drama	NULL	UK
Imperium: Augustus	/wiki/Imperium:_Augustus	2003	Roger Young	Peter O'Toole, Charlotte Rampling	Drama	NULL	UK
Johnny English	/wiki/Johnny_English	2003	Peter Howitt	Rowan Atkinson, John Malkovich	Spy/Comedy	NULL	UK
Kiss of Life	/wiki/Kiss_of_Life_(film)	2003	Emily Young	Gemma Jones	Drama	Screened at the 2003 Cannes Film Festival	UK
The Last Horror Movie	/wiki/The_Last_Horror_Movie	2003	Julian Richards	Kevin Howarth, Mark Stevenson	Horror	NULL	UK
Love Actually	/wiki/Love_Actually	2003	Richard Curtis	Alan Rickman, Bill Nighy, Emma Thompson, Ant & Dec	Romance	NULL	UK
The Mother	/wiki/The_Mother_(film)	2003	Roger Michell	Anne Reid, Peter Vaughan, Daniel Craig	Drama	NULL	UK
Monsieur N.	/wiki/Monsieur_N.	2003	Antoine de Caunes	Philippe Torreton, Richard E. Grant	Historical	Co-production with France	UK
Owning Mahowny	/wiki/Owning_Mahowny	2003	Richard Kwietniowski	Philip Seymour Hoffman, Minnie Driver, John Hurt	Drama	Co-production with Canada	UK
Peter Pan	/wiki/Peter_Pan_(2003_film)	2003	P.J. Hogan	Jeremy Sumpter, Jason Isaacs	Family	Co-production with Australia and the United States	UK
The Reckoning	/wiki/The_Reckoning_(2003_film)	2003	Paul McGuigan	Paul Bettany, Marián Aguilera, Trevor Steedman	Mystery	NULL	UK
Revengers Tragedy	/wiki/Revengers_Tragedy	2003	Alex Cox	Christopher Eccleston, Derek Jacobi	Drama	NULL	UK
Seeing Double	/wiki/Seeing_Double_(film)	2003	Nigel Dick	Tina Barrett, Jon Lee, Bradley McIntosh, Jo O'Meara, Hannah Spearritt, Rachel Stevens	Comedy/Drama/Musical	NULL	UK
A Short Film About John Bolton	/wiki/A_Short_Film_About_John_Bolton	2003	Neil Gaiman	John O'Mahony, Marcus Brigstocke	Mockumentary	NULL	UK
The Statement	/wiki/The_Statement_(film)	2003	Norman Jewison	Michael Caine, Tilda Swinton, Jeremy Northam	Drama	NULL	UK
Sylvia	/wiki/Sylvia_(2003_film)	2003	Christine Jeffs	Gwyneth Paltrow, Daniel Craig	Biopic	NULL	UK
The Tesseract	/wiki/The_Tesseract_(film)	2003	Oxide Pang	Jonathan Rhys-Meyers, Saskia Reeves	Drama	NULL	UK
This is Not a Love Song	/wiki/This_is_Not_a_Love_Song	2003	Bille Eltringham	Michael Colgan, David Bradley, John Henshaw	Thriller	NULL	UK
To Kill a King	/wiki/To_Kill_a_King	2003	Mike Barker	Tim Roth, Dougray Scott	Historical	Entered into the 25th Moscow International Film Festival	UK
Touching the Void	/wiki/Touching_the_Void_(film)	2003	Kevin MacDonald	Brendan Mackey, Nicholas Aaron, Ollie Ryall	Documentary	NULL	UK
Triads, Yardies and Onion Bhajees	/wiki/Triads,_Yardies_and_Onion_Bhajees	2003	Sarjit Bains	Dave Courtney, Manish Patel	Crime/Thriller	NULL	UK
The Trouble with Men and Women	/wiki/The_Trouble_with_Men_and_Women	2003	Tony Fisher	Joseph McFadden, Kate Ashfield	Drama	NULL	UK
The Tulse Luper Suitcases	/wiki/The_Tulse_Luper_Suitcases	2003	Peter Greenaway	NULL	NULL	Entered into the 2003 Cannes Film Festival	UK
Wondrous Oblivion	/wiki/Wondrous_Oblivion	2003	Paul Morrison	Sam Smith, Delroy Lindo	Sports	NULL	UK
Young Adam	/wiki/Young_Adam	2003	David Mackenzie	Ewan McGregor, Tilda Swinton, Peter Mullan	Thriller/Drama	NULL	UK
9 Songs	/wiki/9_Songs	2004	Michael Winterbottom	Kieran O'Brien, Margo Stilley	Romantic Drama	NULL	UK
Ae Fond Kiss...	/wiki/Ae_Fond_Kiss...	2004	Ken Loach	Atta Yaqub, Eva Birthistle	Drama	NULL	UK
Arsène Lupin	/wiki/Ars%C3%A8ne_Lupin_(2004_film)	2004	Jean-Paul Salomé	Romain Duris, Kristin Scott Thomas	Crime drama	NULL	UK
Being Julia	/wiki/Being_Julia	2004	István Szabó	Annette Bening, Jeremy Irons	Drama	NULL	UK
Beyond the Sea	/wiki/Beyond_the_Sea_(film)	2004	Kevin Spacey	Kevin Spacey, Kate Bosworth	Biopic	NULL	UK
Blind Flight	/wiki/Blind_Flight	2004	John Furse	Linus Roache, Ian Hart	Drama	NULL	UK
Bridget Jones: The Edge of Reason	/wiki/Bridget_Jones:_The_Edge_of_Reason_(film)	2004	Beeban Kidron	Renée Zellweger, Hugh Grant, Colin Firth	Comedy	NULL	UK
Bullet Boy	/wiki/Bullet_Boy	2004	Saul Dibb	Ashley Walters, Luke Fraser	Crime drama	NULL	UK
The Calcium Kid	/wiki/The_Calcium_Kid	2004	Alex De Rakoff	Orlando Bloom, Michael Peña, Billie Piper	Mockumentary	NULL	UK
Churchill: The Hollywood Years	/wiki/Churchill:_The_Hollywood_Years	2004	Peter Richardson	Christian Slater, Neve Campbell	Comedy	NULL	UK
Creep	/wiki/Creep_(2004_film)	2004	Christopher Smith	Franka Potente, Ken Campbell	Horror	NULL	UK
Dead Man's Shoes	/wiki/Dead_Man%27s_Shoes_(2004_film)	2004	Shane Meadows	Paddy Considine, Gary Stretch	Crime Thriller	NULL	UK
Dear Frankie	/wiki/Dear_Frankie	2004	Shona Auerbach	Emily Mortimer, Gerard Butler	Drama	Screened at the 2004 Cannes Film Festival	UK
Ella Enchanted	/wiki/Ella_Enchanted_(film)	2004	Tommy O'Haver	Anne Hathaway, Hugh Dancy	Family	Co-production with US	UK
Enduring Love	/wiki/Enduring_Love_(film)	2004	Roger Michell	Daniel Craig, Rhys Ifans, Samantha Morton	Romance	NULL	UK
Everything	/wiki/Everything_(film)	2004	Richard Hawkins	Ray Winstone, Jan Graveson	Mystery	NULL	UK
Finding Neverland	/wiki/Finding_Neverland_(film)	2004	Marc Forster	Johnny Depp, Kate Winslet, Julie Christie	Drama	NULL	UK
Freak Out	/wiki/Freak_Out_(2004_film)	2004	Christian James	James Heathcote, Dan Palmer	Horror/Comedy	NULL	UK
Freeze Frame	/wiki/Freeze_Frame_(2004_film)	2004	John Simpson	Lee Evans	Thriller	NULL	UK
Harry Potter and the Prisoner of Azkaban	/wiki/Harry_Potter_and_the_Prisoner_of_Azkaban_(film)	2004	Alfonso Cuarón	Daniel Radcliffe, Rupert Grint, Emma Watson	Fantasy	Nominated Alexander Korda Award for Best British Film at the 2005 BAFTA Awards [1]	UK
Head in the Clouds	/wiki/Head_in_the_Clouds	2004	John Duigan	Charlize Theron, Stuart Townsend	Romance/Drama	NULL	UK
I'll Sleep When I'm Dead	/wiki/I%27ll_Sleep_When_I%27m_Dead_(film)	2004	Mike Hodges	Clive Owen, Jonathan Rhys Meyers, Malcolm McDowell	Crime/Drama	NULL	UK
If Only	/wiki/If_Only_(film)	2004	Gil Junger	Jennifer Love Hewitt, Paul Nicholls	Drama	NULL	UK
In My Country	/wiki/In_My_Country	2004	John Boorman	Juliette Binoche, Samuel L. Jackson	Drama	Co-production with Republic of Ireland and South Africa	UK
King Arthur	/wiki/King_Arthur_(film)	2004	Antoine Fuqua	Clive Owen, Stephen Dillane	Action	NULL	UK
Ladies in Lavender	/wiki/Ladies_in_Lavender	2004	Charles Dance	Judi Dench, Maggie Smith	Drama		UK
Layer Cake	/wiki/Layer_Cake_(film)	2004	Matthew Vaughn	Daniel Craig, Sienna Miller, Colm Meaney	Crime thriller	NULL	UK
The Libertine	/wiki/The_Libertine_(2004_film)	2004	Laurence Dunmore	Johnny Depp, Samantha Morton	Historical	NULL	UK
The Life and Death of Peter Sellers	/wiki/The_Life_and_Death_of_Peter_Sellers	2004	Stephen Hopkins	Geoffrey Rush, Charlize Theron	Biopic	Entered into the 2004 Cannes Film Festival	UK
Lighthouse Hill	/wiki/Lighthouse_Hill_(film)	2004	David Fairman	Jason Flemyng, Kirsty Mitchell	Comedy/Romance	NULL	UK
London Voodoo	/wiki/London_Voodoo	2004	Robert Pratten	Doug Cockle, Sara Stewart	Horror		UK
Method	/wiki/Method_(film)	2004	Duncan Roy	Elizabeth Hurley, Jeremy Sisto	Thriller	Co-production	UK
Mickybo and Me	/wiki/Mickybo_and_Me	2004	Terry Loane	John Joe McNeill, Julie Walters, Ciarán Hinds	Comedy/Drama	NULL	UK
Millions	/wiki/Millions_(2004_film)	2004	Danny Boyle	Alex Etel, Lewis McGibbon	Family drama	NULL	UK
Mouth to Mouth	/wiki/Mouth_to_Mouth_(2005_British_film)	2004	Alison Murray	Ellen Page, Natasha Wightman, Eric Thal	Comedy	NULL	UK
My Summer of Love	/wiki/My_Summer_of_Love	2004	Paweł Pawlikowski	Natalie Press, Emily Blunt	Romance	NULL	UK
The Noon Gun	/wiki/The_Noon_Gun	2004	Anthony Stern	NULL	Documentary	NULL	UK
The Phantom of the Opera	/wiki/The_Phantom_of_the_Opera_(2004_film)	2004	Joel Schumacher	Gerard Butler, Emmy Rossum	Musical	NULL	UK
The Queen of Sheba's Pearls	/wiki/The_Queen_of_Sheba%27s_Pearls	2004	Colin Nutley	Helena Bergström, Lorcan Cranitch	Drama	Co-production with Sweden	UK
School for Seduction	/wiki/School_for_Seduction	2004	Sue Heel	Kelly Brook, Dervla Kirwan, Margi Clarke	Romance	NULL	UK
Sex Lives of the Potato Men	/wiki/Sex_Lives_of_the_Potato_Men	2004	Andy Humphries	Johnny Vegas, Mackenzie Crook, Mark Gatiss	Comedy	NULL	UK
Shaun of the Dead	/wiki/Shaun_of_the_Dead	2004	Edgar Wright	Simon Pegg, Kate Ashfield, Nick Frost	Horror/comedy	NULL	UK
Sky Captain and the World of Tomorrow	/wiki/Sky_Captain_and_the_World_of_Tomorrow	2004	Kerry Conran	Gwyneth Paltrow, Jude Law	Adventure	Co-production with Italy and US	UK
Spivs	/wiki/Spivs_(film)	2004	Colin Teague	Kate Ashfield, Ken Stott	Comedy/Crime	NULL	UK
Stage Beauty	/wiki/Stage_Beauty	2004	Richard Eyre	Billy Crudup, Claire Danes, Rupert Everett	Historical drama	NULL	UK
Suzie Gold	/wiki/Suzie_Gold	2004	Richard Cantor	Summer Phoenix, Kevin Bishop, Gem Souleyman	Romance	NULL	UK
Things to Do Before You're 30	/wiki/Things_to_Do_Before_You%27re_30	2004	Simon Shore	Dougray Scott, Emilia Fox, Billie Piper	Drama	NULL	UK
Trauma	/wiki/Trauma_(2004_film)	2004	Marc Evans	Colin Firth, Mena Suvari, Naomie Harris	Thriller	NULL	UK
Troy	/wiki/Troy_(film)	2004	Wolfgang Petersen	Brad Pitt, Orlando Bloom	Action	Co-production with US and Malta	UK
Vanity Fair	/wiki/Vanity_Fair_(2004_film)	2004	Mira Nair	Reese Witherspoon, Romola Garai, James Purefoy	Drama	NULL	UK
Vera Drake	/wiki/Vera_Drake	2004	Mike Leigh	Imelda Staunton, Phil Davis, Eddie Marsan	Drama	Winner of the Golden Lion and Best Actress prizes at the Venice Film Festival	UK
A Way of Life	/wiki/A_Way_of_Life	2004	Amma Asante	Brenda Blethyn, Stephanie James	Drama	NULL	UK
What Happened Today...?	/wiki/What_Happened_Today...%3F	2004	Nick Usher	Jennifer Lynn, Tarik Edeoglu	Instructional	A road safety film	UK
Wimbledon	/wiki/Wimbledon_(film)	2004	Richard Loncraine	Kirsten Dunst, Paul Bettany	Sports	NULL	UK
Winner Takes All	/wiki/Winner_Takes_All_(2004_film)	2004	Helen M. Grace	JC Mac, Chico Slimani	Short Film	NULL	UK
Yasmin	/wiki/Yasmin_(2004_film)	2004	Kenneth Glenaan	Archie Panjabi	Drama	NULL	UK
Asylum	/wiki/Asylum_(2005_film)	2005	David Mackenzie	Natasha Richardson, Marton Csokas, Ian McKellen	Drama	NULL	UK
The Russian Dolls	/wiki/The_Russian_Dolls	2005	Cédric Klapisch	Romain Duris, Kelly Reilly	Comedy drama	1 win & 2 nominations	UK
Beowulf & Grendel	/wiki/Beowulf_%26_Grendel	2005	Sturla Gunnarsson	Gerard Butler, Stellan Skarsgård	Drama	Filmed in Iceland	UK
