The Quiller Memorandum	/wiki/The_Quiller_Memorandum	1966	Michael Anderson	George Segal, Senta Berger, Alec Guinness, Max von Sydow	Spy Thriller	Based on Adam Hall's novel. Nominated for three BAFTAs	UK
Rasputin, the Mad Monk	/wiki/Rasputin,_the_Mad_Monk	1966	Don Sharp	Christopher Lee, Barbara Shelley	Horror	NULL	UK
The Reptile	/wiki/The_Reptile	1966	John Gilling	Noel Willman, Jennifer Daniel	Horror	NULL	UK
The Sandwich Man	/wiki/The_Sandwich_Man_(1966_film)	1966	Robert Hartford-Davis	Michael Bentine, Dora Bryan, Harry H. Corbett	Comedy	NULL	UK
Sky West and Crooked	/wiki/Sky_West_and_Crooked	1966	John Mills	Hayley Mills	Romantic drama	NULL	UK
The Spy with a Cold Nose	/wiki/The_Spy_with_a_Cold_Nose	1966	Daniel Petrie	Laurence Harvey, Daliah Lavi	Comedy	NULL	UK
That Riviera Touch	/wiki/That_Riviera_Touch	1966	Cliff Owen	Eric Morecambe, Ernie Wise	Comedy	NULL	UK
They're a Weird Mob	/wiki/They%27re_a_Weird_Mob_(film)	1966	Michael Powell	Walter Chiari, Clare Dunne, Chips Rafferty	Adventure/Comedy	NULL	UK
Thunderbirds Are Go	/wiki/Thunderbirds_Are_Go	1966	David Lane	Peter Dyneley, Sylvia Anderson	Sci-fi	NULL	UK
The Trap	/wiki/The_Trap_(1966_film)	1966	Sidney Hayers	Oliver Reed, Rita Tushingham	Action	NULL	UK
Triple Cross	/wiki/Triple_Cross_(1966_film)	1966	Terence Young	Christopher Plummer, Romy Schneider, Gert Fröbe	Spy/Thriller	NULL	UK
The Trygon Factor	/wiki/The_Trygon_Factor	1966	Cyril Frankel	Stewart Granger, Susan Hampshire	Thriller	NULL	UK
The Uncle	/wiki/The_Uncle	1966	Desmond Davis	Rupert Davies, Brenda Bruce	Drama	NULL	UK
Where the Bullets Fly	/wiki/Where_the_Bullets_Fly	1966	John Gilling	Tom Adams, Dawn Addams	Espionage	NULL	UK
Who Killed the Cat?	/wiki/Who_Killed_the_Cat%3F	1966	Montgomery Tully	Mary Merrall, Ellen Pollock	Mystery	NULL	UK
The Witches	/wiki/The_Witches_(1966_film)	1966	Cyril Frankel	Joan Fontaine, Alec McCowen, Kay Walsh	Horror	NULL	UK
The Wrong Box	/wiki/The_Wrong_Box	1966	Bryan Forbes	John Mills, Ralph Richardson, Michael Caine	Comedy	NULL	UK
Accident	/wiki/Accident_(1967_film)	1967	Joseph Losey	Dirk Bogarde, Stanley Baker, Jacqueline Sassard	Drama	NULL	UK
Africa Texas Style	/wiki/Africa_Texas_Style	1967	Andrew Marton	John Mills, Hugh O'Brian	Adventure	NULL	UK
Attack on the Iron Coast	/wiki/Attack_on_the_Iron_Coast	1967	Paul Wendkos	Lloyd Bridges, Andrew Keir	War	NULL	UK
Battle Beneath the Earth	/wiki/Battle_Beneath_the_Earth	1967	Montgomery Tully	Kerwin Mathews, Viviane Ventura	Sci Fi	NULL	UK
Bedazzled	/wiki/Bedazzled_(1967_film)	1967	Stanley Donen	Peter Cook, Dudley Moore	Comedy	NULL	UK
Berserk!	/wiki/Berserk!	1967	Jim O'Connolly	Joan Crawford, Ty Hardin	Horror/Slasher	NULL	UK
Billion Dollar Brain	/wiki/Billion_Dollar_Brain	1967	Ken Russell	Michael Caine, Karl Malden, Françoise Dorléac, Oskar Homolka	Spy thriller	Based on Len Deighton's novel	UK
The Bobo	/wiki/The_Bobo	1967	Robert Parrish	Peter Sellers, Britt Ekland	Comedy	NULL	UK
Carry On Doctor	/wiki/Carry_On_Doctor	1967	Gerald Thomas	Kenneth Connor, Frankie Howerd	Comedy	NULL	UK
Casino Royale	/wiki/Casino_Royale_(1967_film)	1967	Ken Hughes, John Huston, Joseph McGrath, Robert Parrish, Val Guest	David Niven, Peter Sellers, Ursula Andress	Comedy	NULL	UK
A Challenge for Robin Hood	/wiki/A_Challenge_for_Robin_Hood	1967	C.M. Pennington-Richards	Barrie Ingham, Peter Blythe	Adventure	NULL	UK
Charlie Bubbles	/wiki/Charlie_Bubbles	1967	Albert Finney	Albert Finney, Billie Whitelaw	Drama	NULL	UK
A Countess from Hong Kong	/wiki/A_Countess_from_Hong_Kong	1967	Charles Chaplin	Marlon Brando, Sophia Loren	Drama	Chaplin's last film as a director	UK
Cuckoo Patrol	/wiki/Cuckoo_Patrol	1967	Duncan Wood	Freddie Garrity, Kenneth Connor	Comedy/Musical	NULL	UK
Danger Route	/wiki/Danger_Route	1967	Seth Holt	Richard Johnson, Carol Lynley	Thriller	NULL	UK
The Day the Fish Came Out	/wiki/The_Day_the_Fish_Came_Out	1967	Michael Cacoyannis	Tom Courtenay, Sam Wanamaker, Candice Bergen	Comedy	NULL	UK
Deadlier Than the Male	/wiki/Deadlier_Than_the_Male	1967	Ralph Thomas	Richard Johnson, Elke Sommer	Adventure	NULL	UK
Doctor Faustus	/wiki/Doctor_Faustus_(1967_film)	1967	Richard Burton, Nevill Coghill	Elizabeth Taylor, Richard Burton	Drama	NULL	UK
The Double Man	/wiki/The_Double_Man_(1967_film)	1967	Franklin J. Schaffner	Yul Brynner, Britt Ekland	Thriller	NULL	UK
Far from the Madding Crowd	/wiki/Far_from_the_Madding_Crowd_(1967_film)	1967	John Schlesinger	Julie Christie, Alan Bates, Terence Stamp, Peter Finch	Literary drama	Number 79 in the BFI Top 100 British films	UK
Fathom	/wiki/Fathom	1967	Leslie H. Martinson	Raquel Welch, Anthony Franciosa	Comedy Thriller	NULL	UK
The Fearless Vampire Killers	/wiki/The_Fearless_Vampire_Killers	1967	Roman Polanski	Jack MacGowran, Sharon Tate	Comedy horror	British-American co-production	UK
Follow That Camel	/wiki/Follow_That_Camel	1967	Gerald Thomas	Phil Silvers, Kenneth Williams	Comedy	NULL	UK
Frankenstein Created Woman	/wiki/Frankenstein_Created_Woman	1967	Terence Fisher	Peter Cushing, Susan Denberg	Horror	NULL	UK
Half a Sixpence	/wiki/Half_a_Sixpence_(film)	1967	George Sidney	Tommy Steele	Musical		UK
Here We Go Round the Mulberry Bush	/wiki/Here_We_Go_Round_the_Mulberry_Bush_(film)	1967	Clive Donner	Barry Evans, Judy Geeson	Drama	NULL	UK
A Home of Your Own	/wiki/A_Home_of_Your_Own	1967	Jay Lewis	Bridget Armstrong, Ronnie Barker	Comedy	Short film	UK
How I Won the War	/wiki/How_I_Won_the_War	1967	Richard Lester	Michael Crawford, John Lennon	Dark comedy	NULL	UK
I'll Never Forget What's 'Isname	/wiki/I%27ll_Never_Forget_What%27s_%27Isname	1967	Michael Winner	Oliver Reed, Carol White	Drama	NULL	UK
The Jokers	/wiki/The_Jokers	1967	Michael Winner	Michael Crawford, Oliver Reed	Comedy	NULL	UK
Jules Verne's Rocket to the Moon	/wiki/Jules_Verne%27s_Rocket_to_the_Moon	1967	Don Sharp	Burl Ives, Terry-Thomas, Gert Fröbe	Sci Fi/Comedy	NULL	UK
Just like a Woman	/wiki/Just_like_a_Woman_(1967_film)	1967	Robert Fuest	Wendy Craig, Francis Matthews	Comedy	NULL	UK
The Last Safari	/wiki/The_Last_Safari	1967	Henry Hathaway	Kaz Garas, Stewart Granger	Adventure	NULL	UK
The Long Duel	/wiki/The_Long_Duel	1967	Ken Annakin	Yul Brynner, Trevor Howard	Action	NULL	UK
The Magnificent Two	/wiki/The_Magnificent_Two	1967	Cliff Owen	Eric Morecambe, Ernie Wise	Comedy	NULL	UK
The Man Outside	/wiki/The_Man_Outside_(1967_film)	1967	Samuel Gallu	Van Heflin, Heidelinde Weis	Thriller	NULL	UK
Marat/Sade	/wiki/Marat/Sade_(film)	1967	Peter Brook	Ian Richardson, Patrick Magee Glenda Jackson	Drama	Film adaptation of the play	UK
Maroc 7	/wiki/Maroc_7	1967	Gerry O'Hara	Gene Barry, Elsa Martinelli	Thriller	NULL	UK
The Mini-Affair	/wiki/The_Mini-Affair	1967	Robert Anram	Georgie Fame, Rosemary Nicols	Romance/Comedy	NULL	UK
Mister Ten Per Cent	/wiki/Mister_Ten_Per_Cent	1967	Peter Graham Scott	Charlie Drake, Derek Nimmo, Wanda Ventham, John Le Mesurier	Comedy	NULL	UK
The Mummy's Shroud	/wiki/The_Mummy%27s_Shroud	1967	John Gilling	André Morell, John Phillips	Horror	NULL	UK
The Naked Runner	/wiki/The_Naked_Runner	1967	Sidney J. Furie	Frank Sinatra, Edward Fox	Spy	NULL	UK
Night of the Big Heat	/wiki/Night_of_the_Big_Heat_(1967_film)	1967	Terence Fisher	Christopher Lee, Patrick Allen, Peter Cushing	Sci-fi/Horror	NULL	UK
The Night of the Generals	/wiki/The_Night_of_the_Generals	1967	Anatole Litvak	Peter O'Toole, Omar Sharif	Thriller	Co-production with France	UK
Our Mother's House	/wiki/Our_Mother%27s_House	1967	Jack Clayton	Dirk Bogarde, Pamela Franklin	Drama	NULL	UK
The Penthouse	/wiki/The_Penthouse	1967	Peter Collinson	Suzy Kendall, Terence Morgan	Drama	NULL	UK
The Plank	/wiki/The_Plank_(1967_film)	1967	Eric Sykes	Eric Sykes, Tommy Cooper	Comedy	NULL	UK
Poor Cow	/wiki/Poor_Cow	1967	Ken Loach	Terence Stamp, Carol White, John Bindon	Drama	NULL	UK
Pretty Polly	/wiki/Pretty_Polly_(film)	1967	Guy Green	Hayley Mills, Trevor Howard	Romance/Comedy	NULL	UK
Privilege	/wiki/Privilege_(film)	1967	Peter Watkins	Paul Jones, Jean Shrimpton	Comedy/Musical	NULL	UK
The Projected Man	/wiki/The_Projected_Man	1967	Ian Curteis, John Croydon	Mary Peach, Bryant Halliday	Science fiction	NULL	UK
Quatermass and the Pit	/wiki/Quatermass_and_the_Pit_(film)	1967	Roy Ward Baker	James Donald, Andrew Keir	Science Fiction	NULL	UK
Ride of the Valkyrie	/wiki/Ride_of_the_Valkyrie_(1967_film)	1967	Peter Brook	Julia Foster, Zero Mostel, Frank Thornton	Comedy	Short film	UK
Robbery	/wiki/Robbery_(1967_film)	1967	Peter Yates	Stanley Baker, Joanna Pettet	Crime/Drama	NULL	UK
The Sailor from Gibraltar	/wiki/The_Sailor_from_Gibraltar	1967	Tony Richardson	Jeanne Moreau, Ian Bannen	Drama	NULL	UK
The Shuttered Room	/wiki/The_Shuttered_Room	1967	David Greene	Oliver Reed, Gig Young	Horror	NULL	UK
Smashing Time	/wiki/Smashing_Time	1967	Desmond Davis	Rita Tushingham, Lynn Redgrave	Comedy	NULL	UK
Some May Live	/wiki/Some_May_Live	1967	Vernon Sewell	Peter Cushing, Joseph Cotten	Thriller	NULL	UK
The Sorcerers	/wiki/The_Sorcerers	1967	Michael Reeves	Boris Karloff, Catherine Lacey	Horror	NULL	UK
Stranger in the House	/wiki/Stranger_in_the_House_(1967_film)	1967	Pierre Rouve	James Mason, Geraldine Chaplin	Crime	NULL	UK
The Terrornauts	/wiki/The_Terrornauts	1967	Montgomery Tully	Simon Oates, Zena Marshall, Charles Hawtrey	Sci-fi	NULL	UK
They Came from Beyond Space	/wiki/They_Came_from_Beyond_Space	1967	Freddie Francis	Robert Hutton, Jennifer Jayne	Sci-fi	NULL	UK
To Sir, with Love	/wiki/To_Sir,_with_Love	1967	James Clavell	Sidney Poitier, Judy Geeson, Lulu	Drama	NULL	UK
Torture Garden	/wiki/Torture_Garden_(film)	1967	Freddie Francis	Burgess Meredith, Jack Palance	Horror	NULL	UK
Two for the Road	/wiki/Two_for_the_Road_(film)	1967	Stanley Donen	Audrey Hepburn, Albert Finney, William Daniels, Eleanor Bron	Comedy	NULL	UK
Two Weeks in September	/wiki/Two_Weeks_in_September	1967	Serge Bourguignon	Brigitte Bardot, Laurent Terzieff	Drama	Co-production with France	UK
Ulysses	/wiki/Ulysses_(1967_film)	1967	Joseph Strick	Milo O'Shea, Barbara Jefford	Drama	Co-production with the United States	UK
The Vengeance of Fu Manchu	/wiki/The_Vengeance_of_Fu_Manchu	1967	Jeremy Summers	Christopher Lee, Douglas Wilmer, Tsai Chin	Action/Drama	NULL	UK
The Viking Queen	/wiki/The_Viking_Queen	1967	Don Chaffey	Don Murray, Carita	Historical	NULL	UK
The Vulture	/wiki/The_Vulture_(1967_film)	1967	Lawrence Huntington	Robert Hutton, Akim Tamiroff	Sci-fi/Horror	NULL	UK
The Whisperers	/wiki/The_Whisperers	1967	Bryan Forbes	Edith Evans, Eric Portman, Gerald Sim	Drama	Evans won the Silver Bear for Best Actress at Berlin	UK
The White Bus	/wiki/The_White_Bus	1967	Lindsay Anderson	Arthur Lowe, Patricia Healey	Drama	Short film	UK
You Only Live Twice	/wiki/You_Only_Live_Twice_(film)	1967	Lewis Gilbert	Sean Connery, Donald Pleasence	Spy/Action	NULL	UK
2001: A Space Odyssey	/wiki/2001:_A_Space_Odyssey_(film)	1968	Stanley Kubrick	Keir Dullea, Gary Lockwood, William Sylvester	Science Fiction	NULL	UK
All Neat in Black Stockings	/wiki/All_Neat_in_Black_Stockings	1968	Christopher Morahan	Victor Henry, Susan George	Comedy	NULL	UK
Amsterdam Affair	/wiki/Amsterdam_Affair	1968	Gerry O'Hara	Wolfgang Kieling, William Marlowe, Catherine Schell	Crime	NULL	UK
The Anniversary	/wiki/The_Anniversary_(1968_film)	1968	Roy Ward Baker	Bette Davis	Drama	NULL	UK
Assignment K	/wiki/Assignment_K	1968	Val Guest	Stephen Boyd, Michael Redgrave	Thriller	NULL	UK
Attack on the Iron Coast	/wiki/Attack_on_the_Iron_Coast	1968	Paul Wendkos	Lloyd Bridges, Andrew Keir	War	NULL	UK
Baby Love	/wiki/Baby_Love_(film)	1968	Alastair Reid	Ann Lynn, Keith Barron, Linda Hayden, Diana Dors	Drama	NULL	UK
Berserk!	/wiki/Berserk!	1968	Jim O'Connolly	Joan Crawford, Diana Dors	Thriller	NULL	UK
Les Bicyclettes de Belsize	/wiki/Les_Bicyclettes_de_Belsize	1968	Douglas Hickox	Judy Huxtable, Anthony May	Musical	Short film	UK
The Birthday Party	/wiki/The_Birthday_Party_(film)	1968	William Friedkin	Robert Shaw, Patrick Magee	Drama	NULL	UK
The Bliss of Mrs. Blossom	/wiki/The_Bliss_of_Mrs._Blossom	1968	Joseph McGrath	Shirley MacLaine, Richard Attenborough	Comedy	NULL	UK
The Blood Beast Terror	/wiki/The_Blood_Beast_Terror	1968	Vernon Sewell	Peter Cushing, Robert Flemyng	Horror	NULL	UK
The Blood of Fu Manchu	/wiki/The_Blood_of_Fu_Manchu	1968	Jesús Franco	Christopher Lee, Richard Greene	Crime	NULL	UK
The Bofors Gun	/wiki/The_Bofors_Gun	1968	Jack Gold	Nicol Williamson, Ian Holm	Drama	NULL	UK
Boom!	/wiki/Boom!_(1968_film)	1968	Joseph Losey	Elizabeth Taylor, Richard Burton	Drama	NULL	UK
Carry On... Up the Khyber	/wiki/Carry_On..._Up_the_Khyber	1968	Gerald Thomas	Sid James, Kenneth Williams, Joan Sims	Comedy	Number 99 in the BFI Top 100 British films	UK
The Charge of the Light Brigade	/wiki/The_Charge_of_the_Light_Brigade_(1968_film)	1968	Tony Richardson	Trevor Howard, Vanessa Redgrave	War	NULL	UK
Chitty Chitty Bang Bang	/wiki/Chitty_Chitty_Bang_Bang_(film)	1968	Ken Hughes	Dick Van Dyke, Sally Ann Howes	Fantasy	NULL	UK
The Committee	/wiki/The_Committee_(film)	1968	Peter Sykes	Arthur Brown, Paul Jones	Drama	NULL	UK
Corruption	/wiki/Corruption_(1968_film)	1968	Robert Hartford-Davis	Peter Cushing, Sue Lloyd	Horror	NULL	UK
Curse of the Crimson Altar	/wiki/Curse_of_the_Crimson_Altar	1968	Vernon Sewell	Christopher Lee, Boris Karloff	Horror	NULL	UK
A Dandy in Aspic	/wiki/A_Dandy_in_Aspic	1968	Anthony Mann	Laurence Harvey, Tom Courtenay	Spy/Thriller	NULL	UK
Deadfall	/wiki/Deadfall_(1968_film)	1968	Bryan Forbes	Michael Caine, Eric Portman	Crime Thriller	NULL	UK
The Devil Rides Out	/wiki/The_Devil_Rides_Out_(film)	1968	Terence Fisher	Christopher Lee, Charles Gray	Horror	NULL	UK
Diamonds for Breakfast	/wiki/Diamonds_for_Breakfast_(film)	1968	Christopher Morahan	Marcello Mastroianni, Rita Tushingham	Comedy	NULL	UK
Dracula Has Risen from the Grave	/wiki/Dracula_Has_Risen_from_the_Grave	1968	Freddie Francis	Christopher Lee, Rupert Davies	Horror	NULL	UK
Duffy	/wiki/Duffy_(film)	1968	Robert Parrish	James Coburn, James Mason, James Fox	Comedy/Crime	Co-production with the US	UK
The Fiction Makers	/wiki/The_Fiction_Makers	1968	Roy Ward Baker	Roger Moore, Sylvia Syms	Adventure	NULL	UK
The Fixer	/wiki/The_Fixer_(film)	1968	John Frankenheimer	Alan Bates, Dirk Bogarde	Drama	NULL	UK
The Girl on a Motorcycle	/wiki/The_Girl_on_a_Motorcycle	1968	Jack Cardiff	Marianne Faithfull, Alain Delon	Drama	NULL	UK
Great Catherine	/wiki/Great_Catherine_(film)	1968	Gordon Flemyng	Peter O'Toole, Jeanne Moreau	Comedy	NULL	UK
The Hand of Night	/wiki/The_Hand_of_Night	1968	Frederic Goode	William Sylvester, Diane Clare	Horror	NULL	UK
Hostile Witness	/wiki/Hostile_Witness	1968	Ray Milland	Ray Milland, Sylvia Syms	Drama	NULL	UK
Hot Millions	/wiki/Hot_Millions	1968	Eric Till	Peter Ustinov, Karl Malden, Maggie Smith, Bob Newhart	Comedy	NULL	UK
if....	/wiki/If....	1968	Lindsay Anderson	Malcolm McDowell, David Wood	Counterculture	Number 12 in the BFI Top 100 British films	UK
Inadmissible Evidence	/wiki/Inadmissible_Evidence_(film)	1968	Anthony Page	Nicol Williamson, Eleanor Fazan	Drama	NULL	UK
Inspector Clouseau	/wiki/Inspector_Clouseau_(film)	1968	Bud Yorkin	Alan Arkin, Frank Finlay	Comedy	NULL	UK
Interlude	/wiki/Interlude_(1968_film)	1968	Kevin Billington	Oskar Werner, Barbara Ferris	Drama	NULL	UK
Isadora	/wiki/Isadora	1968	Karel Reisz	Vanessa Redgrave, James Fox	Biopic	Redgrave won Best Actress at the 1969 Cannes Film Festival	UK
Joanna	/wiki/Joanna_(1968_film)	1968	Michael Sarne	Geneviève Waïte, Christian Doermer	Drama	Was due to be entered into the 1968 Cannes Film Festival	UK
Journey into Darkness	/wiki/Journey_into_Darkness	1968	James Hill, Peter Sadsy	Robert Reed, Jennifer Hilary	Horror	NULL	UK
Journey to Midnight	/wiki/Journey_to_Midnight	1968	Roy Ward Baker, Alan Gibson	Sebastian Cabot, Bernard Lee	Mystery	NULL	UK
Last of the Long-haired Boys	/wiki/Last_of_the_Long-haired_Boys	1968	Peter Everett	Richard Todd, Gillian Raine	Drama	NULL	UK
The Lion in Winter	/wiki/The_Lion_in_Winter_(1968_film)	1968	Anthony Harvey	Peter O'Toole, Katharine Hepburn, Anthony Hopkins	Historical drama	winner of three Academy Award's	UK
The Long Day's Dying	/wiki/The_Long_Day%27s_Dying	1968	Peter Collinson	David Hemmings, Tony Beckley	War	NULL	UK
Loving Feeling	/wiki/Loving_Feeling	1968	Norman J. Warren	Simon Brent, Georgina Ward	Drama	NULL	UK
The Magus	/wiki/The_Magus_(film)	1968	Guy Green	Michael Caine, Anthony Quinn	Mystery	NULL	UK
Mayerling	/wiki/Mayerling_(1968_film)	1968	Terence Young	Omar Sharif, Catherine Deneuve	Romance/Drama	Based on the Mayerling Incident	UK
The Mercenaries	/wiki/The_Mercenaries_(1968_film)	1968	Jack Cardiff	Rod Taylor, Yvette Mimieux	War	NULL	UK
A Midsummer Night's Dream	/wiki/A_Midsummer_Night%27s_Dream_(1968_film)	1968	Peter Hall	Derek Godfrey, Ian Holm	Comedy	NULL	UK
Mrs. Brown, You've Got a Lovely Daughter	/wiki/Mrs._Brown,_You%27ve_Got_a_Lovely_Daughter_(film)	1968	Saul Swimmer	Stanley Holloway, Peter Noone	Musical	NULL	UK
Negatives	/wiki/Negatives_(1968_film)	1968	Peter Medak	Peter McEnery, Diane Cilento	Drama	NULL	UK
Nobody Runs Forever	/wiki/Nobody_Runs_Forever	1968	Ralph Thomas	Rod Taylor, Christopher Plummer	Thriller	NULL	UK
Oedipus the King	/wiki/Oedipus_the_King_(1968_film)	1968	Philip Saville	Christopher Plummer, Lilli Palmer, Orson Welles, Richard Johnson	Historical drama	NULL	UK
Oliver!	/wiki/Oliver!_(film)	1968	Carol Reed	Mark Lester, Ron Moody, Shani Wallis, Oliver Reed, Harry Secombe, Jack Wild	Musical	Number 77 in the BFI Top 100 British films. Winner of six Academy Award's including Best Picture, 2 Golden Globe Awards and a Special Prize at Moscow	UK
Only When I Larf	/wiki/Only_When_I_Larf_(film)	1968	Basil Dearden	Richard Attenborough, David Hemmings, Alexandra Stewart	Comedy	Based on Len Deighton's novel	UK
Otley	/wiki/Otley_(film)	1968	Dick Clement	Tom Courtenay, Romy Schneider	Comedy/Thriller	NULL	UK
Petulia	/wiki/Petulia	1968	Richard Lester	Julie Christie, George C. Scott, Richard Chamberlain	Drama	NULL	UK
Performance	/wiki/Performance_(film)	1968	Donald Cammell, Nicolas Roeg	Mick Jagger, James Fox	Drama	Not released until 1970	UK
Prudence and the Pill	/wiki/Prudence_and_the_Pill	1968	Fielder Cook, Ronald Neame	Deborah Kerr, David Niven	Comedy	NULL	UK
Romeo and Juliet	/wiki/Romeo_and_Juliet_(1968_film)	1968	Franco Zeffirelli	Leonard Whiting, Olivia Hussey	Literary drama	Adaptation of Shakespeares play	UK
Salt and Pepper	/wiki/Salt_and_Pepper	1968	Richard Donner	Sammy Davis, Jr., Peter Lawford	Comedy	NULL	UK
School for Sex	/wiki/School_for_Sex	1968	Pete Walker	Derek Aylward, Rose Alba	Comedy	NULL	UK
The Sea Gull	/wiki/The_Sea_Gull	1968	Sidney Lumet	James Mason, Vanessa Redgrave	Drama	Co-production with the US	UK
Sebastian	/wiki/Sebastian_(1968_film)	1968	David Greene	Dirk Bogarde, Susannah York	Drama	NULL	UK
Secret Ceremony	/wiki/Secret_Ceremony	1968	Joseph Losey	Elizabeth Taylor, Mia Farrow, Robert Mitchum	Drama	NULL	UK
Shalako	/wiki/Shalako_(film)	1968	Edward Dmytryk	Sean Connery, Brigitte Bardot	Western	NULL	UK
The Strange Affair	/wiki/The_Strange_Affair	1968	David Greene	Michael York, Jeremy Kemp, Susan George	Crime	NULL	UK
Subterfuge	/wiki/Subterfuge_(1968_film)	1968	Peter Graham Scott	Gene Barry, Joan Collins, Richard Todd	Thriller	NULL	UK
Tell Me Lies	/wiki/Tell_Me_Lies	1968	Peter Brook	Mark Jones, Pauline Munro	Drama	NULL	UK
Twisted Nerve	/wiki/Twisted_Nerve	1968	Roy Boulting	Hywel Bennett, Hayley Mills, Billie Whitelaw	Thriller	NULL	UK
A Twist of Sand	/wiki/A_Twist_of_Sand	1968	Don Chaffey	Richard Johnson, Honor Blackman	Adventure	NULL	UK
Up the Junction	/wiki/Up_the_Junction_(1968_film)	1968	Peter Collinson	Dennis Waterman, Maureen Lipman	Drama	NULL	UK
The Vengeance of She	/wiki/The_Vengeance_of_She	1968	Cliff Owen	John Richardson, Olga Schoberová	Fantasy	NULL	UK
Where Eagles Dare	/wiki/Where_Eagles_Dare	1968	Brian G. Hutton	Richard Burton, Clint Eastwood, Mary Ure	World War II/Action	NULL	UK
Witchfinder General	/wiki/Witchfinder_General_(film)	1968	Michael Reeves	Vincent Price, Ian Ogilvy, Hilary Dwyer	Horror	NULL	UK
Wonderwall	/wiki/Wonderwall_(film)	1968	Joe Massot	Jack MacGowran, Jane Birkin, Richard Wattis	Drama	NULL	UK
Work Is a Four-Letter Word	/wiki/Work_Is_a_Four-Letter_Word	1968	Peter Hall	David Warner, Cilla Black	Comedy	NULL	UK
Yellow Submarine	/wiki/Yellow_Submarine_(film)	1968	George Dunning	The Beatles, Paul Angelis, John Clive	Musical/Comedy	NULL	UK
The Adding Machine	/wiki/The_Adding_Machine_(film)	1969	Jerome Epstein	Milo O'Shea, Phyllis Diller	Drama	NULL	UK
Alfred the Great	/wiki/Alfred_the_Great_(film)	1969	Clive Donner	David Hemmings, Michael York	Historical	NULL	UK
Anne of the Thousand Days	/wiki/Anne_of_the_Thousand_Days	1969	Charles Jarrott	Richard Burton, Geneviève Bujold, Anthony Quayle	Historical	Academy Award winner	UK
The Assassination Bureau	/wiki/The_Assassination_Bureau	1969	Basil Dearden	Oliver Reed, Diana Rigg, Curt Jürgens	Black comedy	NULL	UK
Battle of Britain	/wiki/Battle_of_Britain_(film)	1969	Guy Hamilton	Laurence Olivier, Trevor Howard, Robert Shaw	World War II	NULL	UK
The Bed-Sitting Room	/wiki/The_Bed-Sitting_Room_(film)	1969	Richard Lester	Rita Tushingham, Dudley Moore	Comedy	NULL	UK
Before Winter Comes	/wiki/Before_Winter_Comes	1969	J. Lee Thompson	David Niven, Topol	Drama	NULL	UK
The Best House in London	/wiki/The_Best_House_in_London	1969	Philip Saville	David Hemmings, Joanna Pettet	Comedy	NULL	UK
The Body Stealers	/wiki/The_Body_Stealers	1969	Gerry Levy	George Sanders, Maurice Evans	Sci-fi	NULL	UK
Bronco Bullfrog	/wiki/Bronco_Bullfrog	1969	Barney Platts-Mills	Del Walker, Anne Gooding	Drama	NULL	UK
Can Hieronymus Merkin Ever Forget Mercy Humppe and Find True Happiness?	/wiki/Can_Hieronymus_Merkin_Ever_Forget_Mercy_Humppe_and_Find_True_Happiness%3F	1969	Anthony Newley	Anthony Newley, Connie Kreski	Comedy	NULL	UK
Captain Nemo and the Underwater City	/wiki/Captain_Nemo_and_the_Underwater_City	1969	James Hill	Robert Ryan, Chuck Connors	Fantasy	Based on novel by Jules Verne	UK
Carry On Again Doctor	/wiki/Carry_On_Again_Doctor	1969	Gerald Thomas	Kenneth Williams, Sid James	Comedy	NULL	UK
Carry On Camping	/wiki/Carry_On_Camping	1969	Gerald Thomas	Sid James, Kenneth Williams	Comedy	NULL	UK
The Chairman	/wiki/The_Chairman	1969	J. Lee Thompson	Gregory Peck, Anne Heywood	Thriller	NULL	UK
Crooks and Coronets	/wiki/Crooks_and_Coronets	1969	Jim O'Connolly	Telly Savalas, Edith Evans	Comedy	NULL	UK
Crossplot	/wiki/Crossplot_(film)	1969	Alvin Rakoff	Roger Moore, Claudia Lange	Thriller	NULL	UK
Dance of Death	/wiki/Dance_of_Death_(film)	1969	David Giles	Laurence Olivier, Geraldine McEwan	Drama	NULL	UK
David Copperfield	/wiki/David_Copperfield_(1969_film)	1969	Delbert Mann	Richard Attenborough, Laurence Olivier, Robin Phillips	Drama	NULL	UK
Doppelgänger	/wiki/Doppelg%C3%A4nger_(1969_film)	1969	Robert Parrish	Roy Thinnes, Ian Hendry	Sci fi	NULL	UK
The File of the Golden Goose	/wiki/The_File_of_the_Golden_Goose	1969	Sam Wanamaker	Yul Brynner, Charles Gray	Thriller	NULL	UK
Frankenstein Must Be Destroyed	/wiki/Frankenstein_Must_Be_Destroyed	1969	Terence Fisher	Peter Cushing, Freddie Jones	Horror	NULL	UK
Guns in the Heather	/wiki/Guns_in_the_Heather	1969	Robert Butler	Glenn Corbett, Alfred Burke	Family	Co-production with US	UK
Hamlet	/wiki/Hamlet_(1969_film)	1969	Tony Richardson	Nicol Williamson, Anthony Hopkins	Literary drama	Adaptation of Shakespeare's play	UK
Hannibal Brooks	/wiki/Hannibal_Brooks	1969	Michael Winner	Oliver Reed, Michael J Pollard	World War II	NULL	UK
The Haunted House of Horror	/wiki/The_Haunted_House_of_Horror	1969	Michael Armstrong	Frankie Avalon, Jill Haworth	Horror	NULL	UK
I Start Counting	/wiki/I_Start_Counting	1969	David Greene	Jenny Agutter, Bryan Marshall	Thriller	NULL	UK
In Search of Gregory	/wiki/In_Search_of_Gregory	1969	Peter Wood	Julie Christie, Michael Sarrazin	Romance	NULL	UK
The Italian Job	/wiki/The_Italian_Job	1969	Peter Collinson	Michael Caine, Noël Coward, Benny Hill	Action/Comedy	Number 36 in the BFI Top 100 British films	UK
Kes	/wiki/Kes_(film)	1969	Ken Loach	David Bradley, Lynne Perrie	Drama	Number 7 in the BFI Top 100 British films	UK
The Last Shot You Hear	/wiki/The_Last_Shot_You_Hear	1969	Gordon Hessler	Hugh Marlowe, Zena Walker	Thriller	NULL	UK
Laughter in the Dark	/wiki/Laughter_in_the_Dark_(film)	1969	Tony Richardson	Nicol Williamson, Anna Karina	Drama	NULL	UK
Leo the Last	/wiki/Leo_the_Last	1969	John Boorman	Marcello Mastroianni, Billie Whitelaw	Drama	NULL	UK
Lock Up Your Daughters!	/wiki/Lock_Up_Your_Daughters!	1969	Peter Coe	Christopher Plummer, Susannah York	Comedy	NULL	UK
Lola	/wiki/Lola_(1969_film)	1969	Richard Donner	Charles Bronson, Susan George	Comedy	NULL	UK
The Looking Glass War	/wiki/The_Looking_Glass_War	1969	Frank Pierson	Christopher Jones, Ralph Richardson	Spy	NULL	UK
The Magic Christian	/wiki/The_Magic_Christian_(film)	1969	Joseph McGrath	Ringo Starr, Peter Sellers	Comedy	NULL	UK
Man of Violence	/wiki/Man_of_Violence	1969	Pete Walker	Michael Latimer, Luan Peters	Crime	NULL	UK
Monte Carlo or Bust!	/wiki/Monte_Carlo_or_Bust!	1969	Ken Annakin	Terry-Thomas, Tony Curtis	Comedy	NULL	UK
Moon Zero Two	/wiki/Moon_Zero_Two	1969	Roy Ward Baker	James Olson, Catherine Schell	Sci Fi	NULL	UK
Mosquito Squadron	/wiki/Mosquito_Squadron	1969	Boris Sagal	David McCallum	World War II	NULL	UK
Mumsy, Nanny, Sonny and Girly	/wiki/Mumsy,_Nanny,_Sonny_and_Girly	1969	Freddie Francis	Ursula Howells, Pat Heywood, Howard Trevor	Horror/Comedy	NULL	UK
A Nice Girl Like Me	/wiki/A_Nice_Girl_Like_Me	1969	Desmond Davis	Barbara Ferris, Harry Andrews	Comedy	NULL	UK
The Oblong Box	/wiki/The_Oblong_Box_(film)	1969	Gordon Hessler	Vincent Price, Christopher Lee	Horror	NULL	UK
Oh! What a Lovely War	/wiki/Oh!_What_a_Lovely_War	1969	Richard Attenborough	John Mills, Laurence Olivier, Maggie Smith	World War I Musical	NULL	UK
On Her Majesty's Secret Service	/wiki/On_Her_Majesty%27s_Secret_Service_(film)	1969	Peter R. Hunt	George Lazenby, Diana Rigg, Telly Savalas	Spy/Action	NULL	UK
Play Dirty	/wiki/Play_Dirty	1969	André de Toth	Michael Caine, Nigel Green	World War II	NULL	UK
